asin,product_title,brand,price,discount_percent,rating,review_count,category,product_link,search_term
B0CTHVX6DK,"Sennheiser MOMENTUM True Wireless 4 Earbuds,TrueResponse Drivers, Lossless Audio, Auracast, Adaptive ANC, Anti‑Wind+Transparency Modes, 30 Hrs Battery, Qi Fast Charge,6‑Mics,1Y Warranty,Black-Graphite",Sennheiser,18990,(37% off),4.3,2.5K,Audio,https://www.amazon.in/dp/B0CTHVX6DK,earbuds
B0DRD7G7F5,"realme Buds Air 7,12.4mm Dynamic Bass Drivers,52Hrs Playtime,52dB Hybrid ANC,6 Mic ENC,45ms Low Latency,360° Spatial Audio,Hi-Res LHDC,IP55 Dust & Water Resistant,True Wireless TWS BT v5.4(Moss Green)",realme,3259,(35% off),4.3,3.1K,Audio,https://www.amazon.in/dp/B0DRD7G7F5,earbuds
B0GLYTPRRG,"NovaMart UltraPods Max True Wireless Earbuds with Bluetooth 5.3, Enhanced Sound Quality, Touch Control,Battery Life, Noise Cancellation & Comfortable Fit",NovaMart,278,(72% off),3.4,20,Audio,https://www.amazon.in/dp/B0GLYTPRRG,earbuds
B0DJ8KY3FT,"Boat Airdopes Loop OWS Earbuds w/Clip-On Fit, Air Conduction Tech, 50HRS Battery, 4Mics ENx, Dual EQ Modes, 12mm Drivers, 40ms Latency, ASAP Charge, OWS Ear Buds in Ear Bluetooth Earphones(Cool Grey)",Boat,1799,(77% off),3.1,1.9K,Audio,https://www.amazon.in/dp/B0DJ8KY3FT,earbuds
B0FTF786Q8,"Mivi DuoPods Echo Earbuds [New Launch], 60 Hours Playtime, AI-ENC for HD Calls, 13mm Drivers, IPX 4.0, BT v5.3, Made in India True Wireless Bluetooth Ear Buds",Mivi,699,(77% off),4.3,207,Audio,https://www.amazon.in/dp/B0FTF786Q8,earbuds
B0GDQ28DY5,"realme Buds Air 8,11mm+6mm Dual Dynamic Bass Drivers,58Hrs Playtime, 55dB ANC,6 Mic ENC, 45ms Low Latency, 360° Spatial Audio, Hi-Res LHDC, IP55 Dust & Water Resistant, BT v5.4 (Master Grey)",realme,3799,(28% off),4.2,317,Audio,https://www.amazon.in/dp/B0GDQ28DY5,earbuds
B0CF5PNVZH,"Boat Nirvana Ion ANC, Active Noise Cancellation(~32dB), 120Hrs Battery, App Support, Crystal Bionic Sound, 4Mics ENx, v5.3 Bluetooth TWS in Ear Earbuds Wireless Earphones with mic (Crystal Black)",Boat,1999,(80% off),4.0,22.1K,Audio,https://www.amazon.in/dp/B0CF5PNVZH,earbuds
B0CRTPF7CZ,"soundcore R50I NC by Anker Noise Cancelling in Ear Earbuds,Strong 42Db Adaptive Noise Cancelling,Powerful Bass,45H Playtime,2-in-1 Case and Phone Stand,Ip54,Fast Charge 10Min = 120 Min,Bluetooth 5.4",soundcore,1499,(70% off),4.0,27.2K,Audio,https://www.amazon.in/dp/B0CRTPF7CZ,earbuds
B0GQ9KP9T8,Wireless Earbuds Bluetooth 5.1 TWS Earphones Full Touch Control Headphones Built-in Microphone Immersive Sound Quality Ensure Fast Stable & Connection Smart LED Headset Sports Bud (Black),Wireless,249,(64% off),,,Audio,https://www.amazon.in/dp/B0GQ9KP9T8,earbuds
B0FJMD7DL1,"Mivi DuoPods Aura 35 dB Quad-mic ANC Wireless TWS Earbuds, 60H Playback, 13mm Bass Drivers, Gaming Mode 50ms, Bluetooth v5.3, IPX4 Sweat Proof, Made in India",Mivi,999,(78% off),4.8,41,Audio,https://www.amazon.in/dp/B0FJMD7DL1,earbuds
B0DS2SG8YP,"Noise Buds Trance in-Ear Truly Wireless Earbuds with 45H of Playtime, Low Latency(up to 40 ms), Instacharge(10 min=200 min), BT v5.3(Jet Black)",Noise,999,(60% off),3.9,1K,Audio,https://www.amazon.in/dp/B0DS2SG8YP,earbuds
B0BRSLXGCN,"OnePlus Buds Pro 2 Bluetooth TWS in Ear Earbuds, Spatial Audio Dynamic Head Tracking,co-Created with Dynaudio,Upto 48dB Adaptive Noise Cancellation,Upto 40Hrs Battery[Green]",OnePlus,6409,(54% off),4.0,19.7K,Audio,https://www.amazon.in/dp/B0BRSLXGCN,earbuds
B0FPM5QP4F,"Boat Airdopes 131 Gen 2, 13mm Drivers, 70H Battery, ENx Tech, Beast Mode 45 ms Low Latency, ASAP Charge, Bluetooth Earbuds, TWS Ear Buds Wireless Earphones with mic (Ice Blue)",Boat,799,(73% off),3.8,5.2K,Audio,https://www.amazon.in/dp/B0FPM5QP4F,earbuds
B0C9JPSFN1,"EarFun Air Pro 3 ANC Earbuds Bluetooth Wireless 2023 VGP Gold Award, Qualcomm® aptX™ Adaptive Sound, 6 Mics CVC 8.0 ENC Wireless TWS Earbuds, Bluetooth 5.3, Multipoint Connection (Navy Blue)",EarFun,5899,(34% off),4.3,9.3K,Audio,https://www.amazon.in/dp/B0C9JPSFN1,earbuds
B0FJMFPRS9,"Mivi DuoPods Aura 35 dB Quad-mic ANC Wireless TWS Earbuds, 60H Playback, 13mm Bass Drivers, Gaming Mode 50ms, Bluetooth v5.3, IPX4 Sweat Proof, Made in India",Mivi,999,(78% off),4.8,41,Audio,https://www.amazon.in/dp/B0FJMFPRS9,earbuds
B0CGZJDY84,"Marshall Motif II ANC - True Wireless Active Noise Cancelling Bluetooth Headphones, Earbuds, 30 Hours Playtime – Black",Marshall,19999,,4.0,1.9K,Audio,https://www.amazon.in/dp/B0CGZJDY84,earbuds
B0G261D7YJ,"pTron Bassbuds Indie in-Ear TWS Earbuds w/ 10mm Drivers, 45Hrs Playtime, Dual HD Mic & AI-ENC Calls, Custom EQ, Mobile App, Bluetooth V5.4 Earphones, Voice Assistant, Type C Charging & IPX5 (Gray)",pTron,599,(70% off),3.9,313,Audio,https://www.amazon.in/dp/B0G261D7YJ,earbuds
B07WDKJKSP,"iQOO TWS 1e in-Ear Earbuds with Mic, Upto 30dB Active Noise Cancellation, Fast Charging which Takes 10 mins for 3 Hours Playtime, with Upto 42 hrs Playback time (Flame Yellow)",iQOO,1799,(11% off),4.2,1.6K,Audio,https://www.amazon.in/dp/B07WDKJKSP,earbuds
B0B1SQ3VTQ,"JBL Live Pro 2 Premium in Ear Wireless TWS Earbuds, ANC Earbuds, 40Hr Playtime, Dual Connect, Customized Bass with Headphones App, 6 Mics for Clear Calls, Wireless Charging, Alexa Built-in (Blue)",JBL,7999,(53% off),4.1,5.9K,Audio,https://www.amazon.in/dp/B0B1SQ3VTQ,earbuds
B0FC327YZG,"Boat Nirvana Ivy Pro, Dolby Atmos w/Head Tracking, 52dB Hybrid Adaptive ANC,Hi-Res LDAC, Titanium Dual Drivers, Bluetooth Earbuds, TWS Ear Buds Wireless Earphones w/mic (Ivory Gold)",Boat,4999,(72% off),3.8,726,Audio,https://www.amazon.in/dp/B0FC327YZG,earbuds
B0D63CNLJ9,"GOBOULT x Mustang Torq Wireless in Ear Earbuds with 60H Playtime, App Support, Quad Mic ENC, 45ms Low Latency, 13mm Driver, Breathing LEDs, Made in India Ear Buds Wireless (Blue)",GOBOULT,1499,(75% off),4.0,13K,Audio,https://www.amazon.in/dp/B0D63CNLJ9,earbuds
B0DVL9D7JD,"truke New Launch Buds Elite True Wireless in Ear Earbuds with 10mm Dynamic Driver, 70Hrs Battery & Fast Charging EarBuds, Dual-MIC ENC TWS, 40ms Low Latency Gaming Buds, Volume Control, BT 5.4 (Black)",truke,599,(74% off),3.8,1.1K,Audio,https://www.amazon.in/dp/B0DVL9D7JD,earbuds
B09Y5MK1KB,"Noise Buds VS104 Truly Wireless Earbuds with 45H of Playtime, Quad Mic with ENC, Instacharge(10 Min=200 Min), 13Mm Driver, Low Latency, BT V5.2 (Mint Green)",Noise,799,(77% off),3.8,29.6K,Audio,https://www.amazon.in/dp/B09Y5MK1KB,earbuds
B0DQNTKTVF,"OnePlus Buds Pro 3 Bluetooth TWS in-Ear Buds – Dual Drivers, Dual DACs, Dynaudio EQs, AI-Powered Translator, Up to 50dB Adaptive Noise Cancellation, Up to 43Hrs Battery.",OnePlus,11999,(14% off),4.2,1.1K,Audio,https://www.amazon.in/dp/B0DQNTKTVF,earbuds
B0DPWL48Z5,"Boat Airdopes 91 Prime, 45HRS Battery, 13mm Drivers, Metallic Finish, Low Latency,ENx Tech, Fast Charge, v5.3 Bluetooth TWS in Ear Earbuds Wireless Earphones with mic (Midnight Black)",Boat,699,(82% off),3.5,11.9K,Audio,https://www.amazon.in/dp/B0DPWL48Z5,earbuds
B0F4F171C1,"Sennheiser ACCENTUM Open True Wireless Earbuds-Smart Touch Controls, Lightweight & Breathable Design, Upto 28H Battery, Quick Charging, IPX4 Splash Resistance-Cream",Sennheiser,7989,(38% off),3.7,438,Audio,https://www.amazon.in/dp/B0F4F171C1,earbuds
B0C33XXS56,"Sony WF-1000XM5 Best Active Noise Cancelling Wireless Bluetooth Earbuds with Mic, TWS, Up to 36 Hours Battery Life - Black",Sony,21990,(27% off),3.8,5.4K,Audio,https://www.amazon.in/dp/B0C33XXS56,earbuds
B0BYPFNW6T,"Sony WF-C700N Noise Cancellation Bluetooth Earbuds with Mic, TWS, Up to 15Hrs Battery, Adaptive Sound Control- Black Model: YY2968",Sony,6490,(50% off),3.9,4.4K,Audio,https://www.amazon.in/dp/B0BYPFNW6T,earbuds
B0D9K1TSMP,Sounce Earphone Case Cover for Boat Airdopes 800 TWS Soft Silicone Skin Case Cover Shock Absorbing Protective Case with Keychain [Front LED Visible] - Black,Sounce,209,(58% off),4.1,846,Audio,https://www.amazon.in/dp/B0D9K1TSMP,earbuds
B0GDTRYXYF,"HAMMER Airflow Neo Earbuds with 80H Playtime, 13mm Titanium Driver, 40ms Gaming Mode, Fast Charging Buds, Type-C Charging, Voice Assistant, Lightweight Dual-Tone Design (Grey)",HAMMER,599,(76% off),3.9,182,Audio,https://www.amazon.in/dp/B0GDTRYXYF,earbuds
B0DKJKTPWJ,"JBL Wave Buds 2 Ear Buds Wireless BluetoothV5.3, Active Noise Cancellation Earbuds,Multi Connect, App for Customized Extra Bass Eq, Relax Mode,Speed Charge, 40H Playback, Fast Pair, 4 Mics,IP54 (Blue)",JBL,2999,(57% off),3.4,45.7K,Audio,https://www.amazon.in/dp/B0DKJKTPWJ,earbuds
B0GPDRK31Y,Wireless Earbuds Bluetooth 5.1 TWS Earphones Full Touch Control Headphones Built-in Microphone Immersive Sound Quality Ensure Fast Stable & Connection Smart LED Headset Sports Bud (White),Wireless,269,(46% off),5.0,1,Audio,https://www.amazon.in/dp/B0GPDRK31Y,earbuds
B0DWHB886R,Sony WF-C710N | Dual Noise Cancellation Wireless Bluetooth in Ear Earbuds | AI Call Quality | 40Hrs Battery W/O ANC | 30Hrs Battery with ANC - Blue,Sony,7990,(38% off),3.8,908,Audio,https://www.amazon.in/dp/B0DWHB886R,earbuds
B0GQBQC2B1,Wireless Earbuds Bluetooth 5.1 TWS Earphones Full Touch Control Headphones Built-in Microphone Immersive Sound Quality Ensure Fast Stable & Connection Smart LED Headset Sports Bud (Black) (White),Wireless,269,(46% off),5.0,1,Audio,https://www.amazon.in/dp/B0GQBQC2B1,earbuds
B0GCS56F7W,"Kratos TW02 Ear Buds Wireless with 30H Playtime, Noise Isolation & Clear Calls, Bluetooth Earbuds with Voice Assistant, Ear Buds with Bluetooth V 5.3 & with Type C Fast Charging, IPX5 TWS Earphones",Kratos,549,(73% off),4.3,292,Audio,https://www.amazon.in/dp/B0GCS56F7W,earbuds
B0DK3V1WJW,"JBL New Launch Tune Beam 2 TWS, ANC Earbuds, 48Hr Playtime,Dual Connect,6 Mics, Spatial Sound, Personi-Fi 3.0, Ambient Aware, Relax Mode,Customized EQ with Headphones App,2 Years Warranty (Turquoise)",JBL,4999,(58% off),3.8,5.5K,Audio,https://www.amazon.in/dp/B0DK3V1WJW,earbuds
B0DN6S19M8,"Redmi Buds 6, Dual Driver TWS in Ear Earbuds, 49dB Hybrid Active Noise Cancellation, Spatial Audio, Dual Device Connection, Quad Mic AI ENC, 42 Hrs Playtime, Custom EQ, Wireless Earbuds (Black)",Redmi,2999,(40% off),4.0,4.3K,Audio,https://www.amazon.in/dp/B0DN6S19M8,earbuds
B0FZ9T5JBR,"Noise Newly Launch Buds Play Truly Wireless Earbuds with 40H of Playtime, Quad Mic with ENC, Low Latency for Gaming (Up to 50 Ms), 13mm Driver, BT V6.0(Charcoal Black)",Noise,999,(67% off),4.1,116,Audio,https://www.amazon.in/dp/B0FZ9T5JBR,earbuds
B0DTJD83LH,"BERTH X20 Audio Earbuds with 40ms Low Latency, Bluetooth 5.5, 40H Playtime, Wireless Earbuds with Deep Bass, 13 mm Driver, Siri & OK Google Voice Assistant Support, Ergonomic Fit – Basil Green",BERTH,499.99,(89% off),4.2,14,Audio,https://www.amazon.in/dp/B0DTJD83LH,earbuds
B0DJJM3NB9,"BERTH Airchords Z TWS Earbuds, 40H Playtime, BT 5.4, ENC Mics, 13mm Bass Drivers, 45ms Low Latency, IPX5, Fast Charging, 10min=100min Playback, Gaming Mode, 1-Year Warranty (Blue)",BERTH,399.99,(91% off),3.5,20,Audio,https://www.amazon.in/dp/B0DJJM3NB9,earbuds
B0FVS6LDCT,"Fire-Boltt Aero Ultra TWS Earbuds Custom EQ,Wireless Bluetooth 5.4,Music & App Support, 50H Playtime,Fast Charging Case, 50ms Low Latency for Gaming,Touch Controls,IPX4 Waterproof,Clear Calls - Black",Fire-Boltt,799,(91% off),3.9,9.9K,Audio,https://www.amazon.in/dp/B0FVS6LDCT,earbuds
B0DFMFX3S5,"GOBOULT Made in India K10 Ear Buds Wireless with 50H Playtime, 4 Mics Clear Calling, 45ms Low Latency Gaming, IPX5, 10mm Bass Drivers Earbuds Bluetooth Wireless Earphones(Pure Black)",GOBOULT,799,(68% off),3.9,6.3K,Audio,https://www.amazon.in/dp/B0DFMFX3S5,earbuds
B0GF866ZT4,"GOBOULT Tenet TWS Earbuds with 75H Playtime, Amp App Support, Quad Mic ENC, Dual Device Pairing Buds, 13mm Driver Ear Buds, Bluetooth 5.4 Wireless Earbuds (Midnight Blue)",GOBOULT,1499,(73% off),4.1,521,Audio,https://www.amazon.in/dp/B0GF866ZT4,earbuds
B0DQKXS7DZ,"Boat Nirvana X TWS,Knowles Dual Drivers, Hi-Res Audio LDAC, App Support,4Mic ENx,Dual Pair,Spatial Audio,Fast Charge, Bluetooth Earbuds, TWS Ear Buds Wireless Earphones with mic(Smoky Amethyst)",Boat,1599,(82% off),3.9,790,Audio,https://www.amazon.in/dp/B0DQKXS7DZ,earbuds
B0D3LBFX1W,"Boat Airdopes 300, Cinematic Spatial Audio, 50H Battery, 4Mic AI ENx, Fast Charge, App Support, Low Latency, IPX4, v5.3 Bluetooth Earbuds, TWS in Ear Earbuds Wireless Earphones with mic (Purple Haze)",Boat,1399,(78% off),3.9,9K,Audio,https://www.amazon.in/dp/B0D3LBFX1W,earbuds
B0FS1MBK6P,"Wireless Earbuds,Bluetooth 5.4 Headphones in Ear with Charging Case,HiFi Stereo Sound,IPX8 Waterproof Earphones,48H Playtime,Touch Control Wireless Headphones for iOS/iPhone/Android",Wireless,6432,(51% off),4.9,1.1K,Audio,https://www.amazon.in/dp/B0FS1MBK6P,earbuds
B0D1VH7WMX,"Marshall Minor Iv Wireless in Ear Earbuds with 30+ Hours of Playtime, Water-Resistant, Wireless Charging- Black",Marshall,11999,,3.7,1.6K,Audio,https://www.amazon.in/dp/B0D1VH7WMX,earbuds
B0D17CVCYX,"Sennheiser ACCENTUM True Wireless Earbuds, BT v5.3 Auracast & LE Audio, TrueResponse Drivers, Hybrid ANC + Transparency Mode, 28 Hr Battery, Qi & USB‑C Charging, Touch Control, 2Y Warranty, Black",Sennheiser,9989,(50% off),3.8,509,Audio,https://www.amazon.in/dp/B0D17CVCYX,earbuds
B0CQ4NBJ2F,"GOBOULT Astra Truly Wireless in Ear Earbuds with 48H Playtime, Built-in App Support, 45ms Low Latency Gaming, 4 Mics ENC, Breathing LEDs, 13mm Bass Drivers, TWS Ear Buds (White Opal)",GOBOULT,1199,(66% off),4.0,2.4K,Audio,https://www.amazon.in/dp/B0CQ4NBJ2F,earbuds
B0C3PQ4DG5,"JBL Vibe Beam in-Ear WirelessEarbuds (TWS) with Mic,App for Customized ExtraBass Eq,32Hours Battery&Quick Charge,Ip54 Water&Dust Resistance,AmbientAware&Talk-Thru,Google Fastpair,Touch Control(Beige)",JBL,2699,(55% off),3.6,12K,Audio,https://www.amazon.in/dp/B0C3PQ4DG5,earbuds
B0DGQNXDJP,"Sony WF-C510 Wireless Bluetooth Earbuds with Mic, TWS, in Ear, Ambient Sound Mode, Small and Comfortable, IPX4, Quick Charge, Multipoint Connectivity, Customized EQ, Up to 22 Hours Battery- Blue",Sony,4490,(50% off),4.0,3.7K,Audio,https://www.amazon.in/dp/B0DGQNXDJP,earbuds
B0FJMGRBJ4,"Mivi DuoPods Aura 35 dB Quad-mic ANC Wireless TWS Earbuds, 60H Playback, 13mm Bass Drivers, Gaming Mode 50ms, Bluetooth v5.3, IPX4 Sweat Proof, Made in India",Mivi,999,(78% off),4.8,41,Audio,https://www.amazon.in/dp/B0FJMGRBJ4,earbuds
B0FN7L9JQ1,"Noise Newly Launched Buds N2 Pro Truly Wireless Earbuds with Metallic Finish, 70H of Playtime, ANC(Upto 32Db), Dual Pairing, Instacharge(10 Min=200 Min), BT V6.0(Lunar Silver)",Noise,1799,(64% off),3.8,558,Audio,https://www.amazon.in/dp/B0FN7L9JQ1,earbuds
B0D4VNVP7K,"Boat Nirvana Space, 360 Spatial Audio, Active Noise Cancellation (~32dB), 100Hrs Battery,4Mics ENx, Fast Charge, v5.3 Bluetooth TWS in Ear Earbuds Wireless Earphones with mic (Celestial White)",Boat,1999,(75% off),4.0,6.2K,Audio,https://www.amazon.in/dp/B0D4VNVP7K,earbuds
B0D9LT4F24,Samsung Galaxy in Ear Wireless Earbuds 3 Pro (Silver) with Galaxy Ai | Adaptive ANC | Real-Time Interpreter | 24-Bit Hi-Fi Audio | Up to 37H Battery | Ip57,Samsung,14999,(40% off),4.1,1.2K,Audio,https://www.amazon.in/dp/B0D9LT4F24,earbuds
B0DTHPN47Z,"ACwO Dwots Bold Wireless in Ear Earbuds|India'S 1St Smart 1.83"" True HD Touch Display|ANC (32Db)|4 ENC Mics for Clear Calls|Find My Earphone|3D Spatial Sound|Quick Charge |60Hrs Playtime (Bold Black)",ACwO,2499,(78% off),3.7,137,Audio,https://www.amazon.in/dp/B0DTHPN47Z,earbuds
B0DXPL5XHF,"Boat Nirvana Zenith Pro(2025),50dB Hybrid Adaptive ANC,Spatial Audio, Hi-Res Audio LDAC,6Mics AI-ENx,80 Hrs Battery,Bluetooth,TWS Ear Buds Wireless Earphones with mic,NoiseCancellation(Platinum Gold)",Boat,2999,(80% off),4.0,1.4K,Audio,https://www.amazon.in/dp/B0DXPL5XHF,earbuds
B0F7M1JXVV,"New Bose QuietComfort Ultra Bluetooth Earbuds (2nd Gen), Wireless Noise Cancelling Earbuds, Up to 6 Hours Battery, IPX4 Rating, Immersive Audio, Deep Bass, White Smoke",New,32900,,4.2,1.8K,Audio,https://www.amazon.in/dp/B0F7M1JXVV,earbuds
B0FM85ZSR9,"Amazon Basics True Wireless in Ear Earbuds with Mic, Up to 36 Hours Play Time, Low-Latency Gaming Mode, IPX4 Water-Resistance, Bluetooth 5.4 (Black)",Amazon,649,(57% off),3.7,976,Audio,https://www.amazon.in/dp/B0FM85ZSR9,earbuds
B0D3R1JQ7D,"GOBOULT W20 Truly Wireless in Ear Earbuds with 40H Playtime, Zen™ ENC Mic, 45ms Low Latency, 13mm Bass Drivers, Type-C Fast Charging, Touch Control, IPX5 Ear Buds TWS (Glacier Blue)",GOBOULT,799,(68% off),3.9,14.7K,Audio,https://www.amazon.in/dp/B0D3R1JQ7D,earbuds
B0FGNRB3VG,"Amazon Basics Pro Series ANC Wireless in Ear Earbuds, Bluetooth 6.0 TWS Earphones with Mic, Active Noise Cancellation, 4 Mics ENC, 55H Playtime, Smart Touch Control, IPX4 Water Resistant (Black)",Amazon,1921,(47% off),4.0,98,Audio,https://www.amazon.in/dp/B0FGNRB3VG,earbuds
B0GJ5YC84W,"GOBOULT Newly Launched Earl TWS Earbuds with Hybrid ANC (Upto 50dB), 10mm Dual Drivers, Upto 50H Playtime in Ear Earbuds, App Support, Spatial Audio, IPX5, Dual Device Pairing, TWS (Obsidian Black)",GOBOULT,2499,(64% off),4.0,144,Audio,https://www.amazon.in/dp/B0GJ5YC84W,earbuds
B0G43D2S3L,"GOBOULT Raven in Ear TWS Earbuds with 70H Playtime, App Support, Quad Mic ENC, Dual Device Pairing, 10mm Bass Driver, 50ms Ultra Low Latency, Bluetooth 5.4 Wireless Earbuds (Champagne)",GOBOULT,1299,(74% off),4.0,327,Audio,https://www.amazon.in/dp/B0G43D2S3L,earbuds
B09RZLWJQ8,"Sennheiser MOMENTUM True Wireless 3 Earbuds-Flagship TrueResponse Drivers,Adaptive ANC, Anti‑Wind+Transparency Modes,28H Battery,Fast Wireless Charging,6-Mics for Clear Voice,IPX4,1Y Warranty-Graphite",Sennheiser,11495,(54% off),3.5,3.5K,Audio,https://www.amazon.in/dp/B09RZLWJQ8,earbuds
B0DPWJYQK1,"Boat Airdopes 111v2, Premium Leather Finish, 4Mics ENx, 50HRS Battery, 13mm Drivers, Fast Charge, Dual Pair, v5.4 Bluetooth TWS in Ear Earbuds Wireless Earphones with mic (Classic Black)",Boat,1199,(76% off),3.9,10.5K,Audio,https://www.amazon.in/dp/B0DPWJYQK1,earbuds
B0DH2158PJ,Sounce Earphone Case Cover for Boat Airdopes 300 Premium TWS Soft Silicone Skin Case Cover Shock Absorbing Protective Case with Keychain [Front LED Visible] - Black,Sounce,209,(58% off),3.1,551,Audio,https://www.amazon.in/dp/B0DH2158PJ,earbuds
B0G43FRQBL,"GOBOULT Z40 V2.0 with 70H Playtime, Quad Mic ENC, 45ms Low Latency, 13mm Bass, Legacy Continues, IPX5, Bluetooth 5.4, TWS Truly Wireless in Ear Earbuds (Arctic Blue)",GOBOULT,999,(82% off),4.0,1.7K,Audio,https://www.amazon.in/dp/B0G43FRQBL,earbuds
B0CYPYZF63,"Noise Buds Verve 2 in-Ear Truly Wireless Earbuds with Chrome Finish, 50H of Playtime, Quad Mic with ENC, 13mm Driver, Instacharge(10 min=200 min), BT v5.3(Carbon Black)",Noise,1099,(73% off),3.9,927,Audio,https://www.amazon.in/dp/B0CYPYZF63,earbuds
B0F62DV6PQ,"pTron Bassbuds Spark in-Ear TWS Earbuds with Stereo Sound, 40Hrs Playtime, Stereo Calls, Bluetooth V5.3 Headphones with Quick Pairing, Touch Control, Voice Assistant, Type C Charging & IPX5 (Blue)",pTron,597,(70% off),4.0,3.4K,Audio,https://www.amazon.in/dp/B0F62DV6PQ,earbuds
B0FL2W325Z,"Boat Airdopes 213, 50H Battery, ENx Tech, Beast Mode, ASAP Charge, Bluetooth Earbuds, TWS Ear Buds Wireless Earphones with mic (Sandstone)",Boat,999,(78% off),3.9,86,Audio,https://www.amazon.in/dp/B0FL2W325Z,earbuds
B0FTF6CJD4,"Mivi DuoPods Roar [New Launch], 70 Hours Playtime, 3D Soundstage, AI-ENC for HD Calls, 13mm Drivers, IPX 4.0, AAC with BT v5.3, Made in India True Wireless Earbuds",Mivi,999,(75% off),3.4,12,Audio,https://www.amazon.in/dp/B0FTF6CJD4,earbuds
B0G51YJ53N,"GOBOULT Y1 Ear Buds Wireless with 50H Playtime, Clear Calling ENC Mic, Low Latency Gaming, Made in India, 10mm Bass Drivers Earbuds Buds TWS Bluetooth (Green)",GOBOULT,899,(84% off),4.0,207,Audio,https://www.amazon.in/dp/B0G51YJ53N,earbuds
B0FVLFTL4B,"realme Buds T310 Truly Wireless in-Ear Earbuds with 46dB Hybrid ANC, 360° Spatial Audio, 12.4mm Dynamic Bass Driver, Upto 40Hrs Battery and Fast Charging (Dome Green)",realme,2199,(45% off),4.2,64,Audio,https://www.amazon.in/dp/B0FVLFTL4B,earbuds
B0G2GPF8BW,"pTron Bassbuds Tango in-Ear TWS Ear Buds w/Custom EQ, 50hrs Playtime, Pristine Sound, Dual Mic, TruTalk ENC Calls, Mobile App,Wireless Bluetooth V6.0,Touch Controls,Type-C Charging, IPX5 (Nexua Black)",pTron,899,(61% off),4.4,117,Audio,https://www.amazon.in/dp/B0G2GPF8BW,earbuds
B09FYTY1SX,"GravaStar Sirius Pro True Wireless Earbuds Bluetooth 5.2 Headphones TWS RGB Earphones, Bluetooth Earbuds in Ear Noise Cancelling for iPhone Android, IPX5 Waterproof Earphones War Damaged Gray",GravaStar,,,4.1,971,Audio,https://www.amazon.in/dp/B09FYTY1SX,earbuds
B0CRS14PZ5,"truke Buds F1 Ultra True Wireless in Ear Earbuds Spatial Audio Experience, 60H Playtime Ear Buds, Quad Mics Crystal-Clear Calls, Fast Charging, Bluetooth 5.3, Noise Cancellation, Gaming Mode (Black)",truke,799,(73% off),3.8,3.8K,Audio,https://www.amazon.in/dp/B0CRS14PZ5,earbuds
B0F9L8M26Y,"GOBOULT Klarity 4 ANC in-Ear Truly Wireless Earbuds 35dB Active Noise Cancellation, 60H Playtime, 4Mics Calling, 45ms Low Latency, 10mm Driver, Type-C Fast Charging(Electric White)",GOBOULT,999,(71% off),3.6,160,Audio,https://www.amazon.in/dp/B0F9L8M26Y,earbuds
B0D1V9Y875,"Boat Airdopes 800, Dolby Audio, Adaptive EQ by Mimi, 4Mics AI ENx, App Support, Fast Charge, Low Latency, IPX5, v5.3 Bluetooth TWS in Ear Earbuds Wireless Earphones with mic (Interstellar Green)",Boat,1799,(72% off),4.1,8.5K,Audio,https://www.amazon.in/dp/B0D1V9Y875,earbuds
B0CRL6D5PH,boAt Immortal 100 in Ear TWS Earbuds(Black Sabre),boAt,994,(70% off),3.7,5,Audio,https://www.amazon.in/dp/B0CRL6D5PH,earbuds
B0CX96L5VZ,amazon basics TWS in-Ear Earbuds (AB-T17) with Fast Charging up to 70 Hours of Playtime | Dual 13mm Driver | IPX4 Water-Resistance | Bluetooth 5.3 | Charging Case with Mic | Touch Control (Blue),amazon,1071,(57% off),3.8,273,Audio,https://www.amazon.in/dp/B0CX96L5VZ,earbuds
B0G7221VDX,"Humble® Wireless Bluetooth Earbuds with Noise Cancellation, 24H Playtime, Touch Controls, Deep Bass Stereo Sound, Fast Pairing TWS Earphones with Voice Assistant Support – Black",Humble®,798,(68% off),4.0,39,Audio,https://www.amazon.in/dp/B0G7221VDX,earbuds
B0CCYH54YV,"PHILIPS TAT1108WT/00 True Wireless Earbuds, In-Ear, Bluetooth v5.3, Earphones with Mic, 15H Playback,Shank Shape, IPX4, Button Controls, Comfortable Fit, AI Mic for Crystal Clear Sound Quality (White)",PHILIPS,1499,(58% off),4.2,10.9K,Audio,https://www.amazon.in/dp/B0CCYH54YV,earbuds
B09Z7X33H1,"ZEBRONICS Sound Bomb 7 Bluetooth TWS in Ear Earbuds with 60H Playtime, ENC Mic, Rapid Charge, Upto 50ms Gaming Mode, Flash Connect, Voice Assistant, Smooth Touch Control, BT v5.2, Type C (Black)",ZEBRONICS,749,(83% off),3.8,2.7K,Audio,https://www.amazon.in/dp/B09Z7X33H1,earbuds
B0DVLHZXF9,"truke New Launch Buds Aura True Wireless in Ear Earbuds with 70Hrs of Playtime and Fast Charging Ear Buds, 13mm Titanium Drivers, Quad-MIC ENC TWS, 40ms Low Latency Gaming Buds, BT 5.4 (CarbonBlack)",truke,699,(75% off),4.0,695,Audio,https://www.amazon.in/dp/B0DVLHZXF9,earbuds
B0CS3SQNJ8,"Philips TAT1209WT/00 True Wireless Earbuds, in-Ear Active Noise Cancelling Bluetooth v5.3 Earphones with Mic, 18H Play Time, Shank Shape, IPX4, Touch Controls & Charging Case for iPhone/iPad (White)",Philips,1299,(57% off),4.0,7.2K,Audio,https://www.amazon.in/dp/B0CS3SQNJ8,earbuds
B0D49XY9Y8,"Boat Airdopes 121 Pro Plus,100H Battery,4Mics ENx,Low Latency,Fast Charge, LED Display, Stream Ad Free Music via App Support, Bluetooth in Ear Earbuds, TWS Ear Buds Wireless Earphones with mic (Blue)",Boat,1249,(75% off),3.8,28.3K,Audio,https://www.amazon.in/dp/B0D49XY9Y8,earbuds
B0F9PJYFPY,"Noise Newly Launched Buds E1 in-Ear Truly Wireless Earbuds with Pebble Grain Design, 35H of Playtime, Quad mic ENC,10mm Driver, Low Latency, BT v5.3 (Cobalt Blue)",Noise,1099,(69% off),3.8,263,Audio,https://www.amazon.in/dp/B0F9PJYFPY,earbuds
B0FRFRCQ5N,"pTron Zenbuds Evo in-Ear TWS Earbuds w/Dual HD Mic & AI-EN Clear Calls, 13mm Drivers, 32Hrs Playtime, 45ms Movie/Music Modes, Bluetooth v5.3 Wireless Headphones, IPX5 & Type-C Charging (Bold Blue)",pTron,526.75,(86% off),2.8,685,Audio,https://www.amazon.in/dp/B0FRFRCQ5N,earbuds
B0FN7X2YHZ,"Skullcandy Ink’D True Wireless Earbuds, 48Hr Battery + Rapid Charge, Quad-Mic ENC, Multipoint Pairing, 10mm Drivers, Low Latency, Sweat & Water Resistant, Bluetooth v5.4 -Gery Matte",Skullcandy,1999,(80% off),3.8,3.8K,Audio,https://www.amazon.in/dp/B0FN7X2YHZ,earbuds
B0FM3FX7K9,HP H250 Wireless Earbuds Blue,HP,1521,(70% off),5.0,2,Audio,https://www.amazon.in/dp/B0FM3FX7K9,earbuds
B0F7LZC3ZD,"pTron Bassbuds Rogue W/ 40Ms Low-Latency Gaming,Clear Calls,50Hrs Playtime,Pristine Sound,V5.3 Bluetooth in Ear Headphones,Snug-Fit,RGB Lights,Touch Control,Voice Assist,IPX5 Water Resistant(Blue)",pTron,698,(70% off),3.9,410,Audio,https://www.amazon.in/dp/B0F7LZC3ZD,earbuds
B0DHL7SK2C,"HOPPUP Predator Xo3 Gaming Earbuds with 35MS Low Latency, 13MM Drivers & 50H Playtime Bluetooth (Black, True Wireless)",HOPPUP,797,(84% off),3.8,176,Audio,https://www.amazon.in/dp/B0DHL7SK2C,earbuds
B0D2J4FT99,"HAMMER Screen TWS Earbuds Wireless with 13mm Drivers, ANC Ear Buds 32dB, up to 50H Playtime TWS Ear Buds, Type-C Fast Charging, BT v5.4, True Wireless Earbuds Bluetooth,Transparency & EQ Mode (White)",HAMMER,1499,(83% off),3.6,1.5K,Audio,https://www.amazon.in/dp/B0D2J4FT99,earbuds
B0DPXCM5NC,"boAt Airdopes Ultra Pro (2025 Launch), 100Hrs Battery, Dual Pairing, Spatial Audio,App Support, Fast Charge,4Mics ENx, v5.3 Bluetooth Earbuds, TWS Ear Buds Wireless Earphones with mic (Gunmetal Black)",boAt,1707,(76% off),3.8,614,Audio,https://www.amazon.in/dp/B0DPXCM5NC,earbuds
B0F8BVYRWS,"Boat Airdopes Prime 701 ANC, 46dB Hybrid ANC, 50Hr Battery, Real Spatial Audio,Multidevice Connect,App Support, Bluetooth Earbuds, TWS Ear Buds Wireless Earphones with mic (Obsidian Black)",Boat,1899,(76% off),3.9,2.8K,Audio,https://www.amazon.in/dp/B0F8BVYRWS,earbuds
