asin,product_title,brand,price,discount_percent,rating,review_count,category,product_link,search_term
B0DLKX4QVQ,"Hmusic Bluetooth Headphones Neckband, Large Battery 100~200 Hours Playtime, Noise Isolation Wireless Earphones, Magnetic Wireless Earbuds for Sports, Running, Gym, Jobsite (Black)",Hmusic,499,(44% off),4.0,189,Audio,https://www.amazon.in/dp/B0DLKX4QVQ,neckband
B0DS2VB1QP,"Wireless Headphones Neckband Earphones, In Ear Design, Turquoise, with Volume Controls",Wireless,499,(83% off),5.0,1,Audio,https://www.amazon.in/dp/B0DS2VB1QP,neckband
B0GGHTXZHR,"Bluetooth Wireless Neckband Headphones with Magnetic On/Off, BT v5.4, Type-C Charging, Dual Pairing, 10mm Driver, 20+ Hours Playback, Purple",Bluetooth,499,(62% off),1.0,2,Audio,https://www.amazon.in/dp/B0GGHTXZHR,neckband
B0GPDGMJ27,"Drumstone 𝟭𝟓-𝐘𝐞𝐚𝐫 𝐖𝐚𝐫𝐫𝐚𝐧𝐭𝐲 - WX-345 Premium Bluetooth Neckband | 100 Hours Playback, ENC Noise Reduction, Vibrating Alerts, HD Voice | Luxury Gift for Audiophiles & Fitness Buffs",Drumstone,2449,(59% off),5.0,2,Audio,https://www.amazon.in/dp/B0GPDGMJ27,neckband
B0F8BVXTQY,Boat Rockerz 203 Neckband(Grey),Boat,799,(71% off),2.9,6,Audio,https://www.amazon.in/dp/B0F8BVXTQY,neckband
B0DXLDY8PF,Neckband Bluetooth Headphones 100H Playtime IPX6 Waterproof Earbuds Magnetic in-Ear Wireless Earbuds Deep Bass Headset Wireless Stereo Neckband with Mic Home Traveling Outdoor Business Trips（White,Neckband,31525,(12% off),3.6,7,Audio,https://www.amazon.in/dp/B0DXLDY8PF,neckband
B0G8YFS2CM,"STYLIZEPRO ENC Neckband with 50H Playtime, Heavy Bass, Vibrating Alerts, Magnetic Metal Buds, Comfort Fit, Sweatproof Sports Wireless Earphones with Mic, Premium Sound & Track Controls- BLK",STYLIZEPRO,549,(78% off),4.0,1,Audio,https://www.amazon.in/dp/B0G8YFS2CM,neckband
B0FBWNDGRB,"Wireless Bluetooth 5.0 Neckband Earphones, in-Ear Headphones with Mic, 40H Playtime, IPX5 Water Resistant, Fast Charging, Black and Purple",Wireless,399,(71% off),5.0,1,Audio,https://www.amazon.in/dp/B0FBWNDGRB,neckband
B0D8Z5MNZT,"JGD Boom J4 Bluetooth Earphones with 13mm Drivers, Rich Music Experience, 20 Hours Playtime, Type C Fast Charging, Neckband Earphones with Magnetic earpiece,Voice Assistant and Mic (Grey)",JGD,299,(57% off),3.6,31,Audio,https://www.amazon.in/dp/B0D8Z5MNZT,neckband
B0GS3WSJWZ,"1+ Wireless Bluetooth Neckband Earphones, Black, with ANC, Magnetic On/Off, 28 Hours Playback",1+,499,(58% off),,,Audio,https://www.amazon.in/dp/B0GS3WSJWZ,neckband
B0FJ1GY7T1,Transparent Model Bluetooth Neckband Earphone,Transparent,399,(67% off),5.0,1,Audio,https://www.amazon.in/dp/B0FJ1GY7T1,neckband
B0GMRNYVM7,Original Bluetooth Neckband for OnePlus Z2 ANC Earphones – Advanced Active Noise Cancellation Technology & Type-C Charging,Original,1299,(41% off),,,Audio,https://www.amazon.in/dp/B0GMRNYVM7,neckband
B0FVS76HKH,"Fire-Boltt Aero TWS Earbuds Custom EQ, Wireless Bluetooth 5.4, Music & App Support, 50H Playtime, Fast Charging Case, 50ms Low Latency for Gaming, Touch Controls, IPX4 Waterproof, Clear Calls - White",Fire-Boltt,699,(92% off),3.9,9.9K,Audio,https://www.amazon.in/dp/B0FVS76HKH,neckband
B0FVS5PRCH,"Fire-Boltt Aero TWS Earbuds Custom EQ, Wireless Bluetooth 5.4, Music & App Support, 50H Playtime, Fast Charging Case, 50ms Low Latency for Gaming, Touch Controls, IPX4 Waterproof, Clear Calls - Blue",Fire-Boltt,699,(92% off),3.6,573,Audio,https://www.amazon.in/dp/B0FVS5PRCH,neckband
B0GMRBWGFB,"Original for OnePlus Wireless Neckband Z2 ANC – Advanced ANC Tuning, Crystal HD Calling Mic, Powerful Bass Engineering & Instant Charging Support Red",Original,1199,(45% off),,,Audio,https://www.amazon.in/dp/B0GMRBWGFB,neckband
B0GDDS3Y37,"Wireless Bluetooth Neckband with Bluetooth 5.4, Up to 42H Playback, Bass-Enhanced Sound, Sports in-Ear Design, 10M Wireless Range (Black)",Wireless,427,(61% off),4.1,8,Audio,https://www.amazon.in/dp/B0GDDS3Y37,neckband
B0DCGQ1HHT,"Bluetooth Neckband 5.1 Wireless Headphones with Mic, Deep Bass, 10mm Drivers, Clear Calls, Dual Pairing, Type C Fast Charging, Magnetic Buds, Voice Assistant & IPX5 Wireless Neckband (Black",Bluetooth,348,(87% off),3.7,68,Audio,https://www.amazon.in/dp/B0DCGQ1HHT,neckband
B0DTLZLPPN,"APES NeckRhythm Wireless Bluetooth Neckband, 8Hrs Playtime, 10mm Drivers, Bluetooth v5.4 (Purple)",APES,899,(70% off),5.0,2,Audio,https://www.amazon.in/dp/B0DTLZLPPN,neckband
B0GRCYJFPD,"Real Me Neckband 3 Neoo in Ear Bluetooth with 14.4 Mm Dynamic Bass Boost Driver,Upto 32 Hours Playback,Fast Charge,Ai Enc,45Ms Low Latency,Ip55 Dust&Water Resistannt for Apple & Android (Black)",Real,1199,(82% off),,,Audio,https://www.amazon.in/dp/B0GRCYJFPD,neckband
B0DHT1PQV4,"JGD Boom J7 Bluetooth Earphones with 13mm Drivers, Rich Music Experience, 25 Hours Playtime, Type C Fast Charging, Neckband Earphones with Magnetic earpiece,Voice Assistant and Mic (Black)",JGD,299,(70% off),3.8,9,Audio,https://www.amazon.in/dp/B0DHT1PQV4,neckband
B0FR57HG2Z,"Rock 110 Wireless in Ear Neckband with Up to 60 hrs Playtime, Dual Device Pairing, ENx Tech, ASAP Charging, BTv5.3,IPX5,Type-C Interface & Magnetic Power Buds(Active Black), Tech41",Rock,449,(78% off),3.4,5,Audio,https://www.amazon.in/dp/B0FR57HG2Z,neckband
B0GKYJ629H,"Compatible with OnePlus Z2 Bluetooth Neckband Headset with Hybrid Noise Cancellation, 12.4mm Bass Drivers, Fast Charging, Gaming & Music Mode (Black)",Compatible,789,(61% off),,,Audio,https://www.amazon.in/dp/B0GKYJ629H,neckband
B0GPN8GMP5,"Signature Wireless Neckband Earphones VMB-212, Type-C Charging, 72 Hours Backup, Bluetooth Headset",Signature,399,(33% off),,,Audio,https://www.amazon.in/dp/B0GPN8GMP5,neckband
B0D2DN8W1H,"inear MJ-Beat Bluetooth Wireless Neckband Earphones with Mic – Active Noise Cancellation, 24-Hour Music Playback, Type-C Fast Charging, Magnetic Earbuds, Lightweight Design, HD Sound | Blue",inear,599,(50% off),4.0,7,Audio,https://www.amazon.in/dp/B0D2DN8W1H,neckband
B0GCLM7Y21,"Neckband and Wired Earphone, Pack of 2",Neckband,299,(50% off),3.5,2,Audio,https://www.amazon.in/dp/B0GCLM7Y21,neckband
B0GJTLRDBJ,"Wireless Neckband Bluetooth Earphones with Magnetic Sensor On/Off, Type-C Fast Charging, Black and Red",Wireless,,,,,Audio,https://www.amazon.in/dp/B0GJTLRDBJ,neckband
B0FBK4ZCDM,"WRENS NECKBAND-2833 80 Hours Battery Backup, Fast Charge, IPX7, Dual Pairing, Low Latency, Magnetic Earbuds, Bluetooth Neckband, Wireless with Mic Earphones (Multicolor)",WRENS,369,(75% off),,,Audio,https://www.amazon.in/dp/B0FBK4ZCDM,neckband
B0D4F1HGX1,"Toreto Alpha Neo Wireless Earphone Bluetooth Neckband with ENC Mic, Anti Lost, Dual Device Pairing, 30Hr Playtime, Type C Fast Charging, Voice Assistant, Comfortable in Ear & in-line Controls (Black)",Toreto,599,(60% off),5.0,1,Audio,https://www.amazon.in/dp/B0D4F1HGX1,neckband
B0C2V8DVD5,"IKXO Neckband Bluetooth Headphones Wireless Earbuds Sports Earphones HiFi Stereo Magnetic Headsets with Soft Silicone Coating & Built-in Mic, 36 Hours Playtime Lightweight Sweatproof for Workout Gym…",IKXO,48505,(8% off),3.1,13,Audio,https://www.amazon.in/dp/B0C2V8DVD5,neckband
B0DMFNC2PG,"Portronics Harmonics Z9 Wireless Bluetooth in Ear Neckband with Mic, 40 Hours Playtime, Metallic Finish, BT5.3V, 10mm Dynamic Driver, Dual Pairing, Magnetic Buds, Type C Fast Charging(Silver)",Portronics,749,(70% off),3.8,261,Audio,https://www.amazon.in/dp/B0DMFNC2PG,neckband
B0DHT2C8P5,"JGD Boom J6 Bluetooth Earphones with 13mm Drivers, Rich Music Experience, 25 Hours Playtime, Type C Fast Charging, Neckband Earphones with Magnetic earpiece,Voice Assistant and Mic (Gold)",JGD,298,(70% off),3.8,37,Audio,https://www.amazon.in/dp/B0DHT2C8P5,neckband
B0DF7JF2J7,"OOGE Tune 3 in-Ear Bluetooth Gaming Neckband, 35MS Low Latency, Magnetic On-Off, 3D Surround Sound, IPX4 Sweat Resistant, 50H Playtime, 10mm PureTone Driver, Type-C Port, BT5.3, Dual Mic (Ash Grey)",OOGE,699,(65% off),3.8,273,Audio,https://www.amazon.in/dp/B0DF7JF2J7,neckband
B0FCFD3ZNX,"HANQ Wireless Neckband Earphones | Bluetooth 5.2, Type-C Fast Charging, 20+HRS Standby, Magnetic Earbuds, Deep Bass Audio, Lightweight & Comfortable Fit, Sweatproof in-Ear Headphones",HANQ,319,(79% off),4.0,2,Audio,https://www.amazon.in/dp/B0FCFD3ZNX,neckband
B0FDWL6Z27,eppfun Wireless Bluetooth Neckband Headphones QCC3095 LDAC/aptX Adaptive/aptX-HD HiFi Earphone Cable MMCX for Sports Office,eppfun,13825,(22% off),,,Audio,https://www.amazon.in/dp/B0FDWL6Z27,neckband
B07QYWD718,"SONY WI-C200 Wireless Bluetooth Headphones with mic, up to 15h battery life - Black",SONY,9963,(29% off),4.0,7.4K,Audio,https://www.amazon.in/dp/B07QYWD718,neckband
B0F2N579YS,"Bluetooth Headphones Wireless Neckband Bluetooth Earphones Auto Retractable Earbuds with 24H Playtime,Sports Waterproof Earphone,Noise Cancelling with Mic for Running Workout,Blue-Black",Bluetooth,50648,(28% off),2.7,3,Audio,https://www.amazon.in/dp/B0F2N579YS,neckband
B0CS96K97M,"DEWALT Heavy Duty 2-in-1 Neckband Bluetooth Headphones w/Built-in Speakers, Jobsite Wearable Speaker & Around Neck Headphones, Wireless Bluetooth Headset, 60+ Hrs Hands-Free Music/Calls, Carry Pouch",DEWALT,17052,(19% off),4.4,1.6K,Audio,https://www.amazon.in/dp/B0CS96K97M,neckband
B0DV9DC496,"Wireless Bluetooth Neckband Earphones, Sports in-Ear Headphones, Super Bass, Sound, Bluetooth Headphones, 6Hrs Battery Backup (Red)",Wireless,345,(65% off),5.0,1,Audio,https://www.amazon.in/dp/B0DV9DC496,neckband
B0BXPJN22Z,"Wireless Bluetooth Earphones for Sam-Sung Galaxy A51 / A 51 Earphones Original Like Wireless Bluetooth Neckband Flexible In-Ear Headphones Headset With Built-in Mic, Extra Deep Bass Hands-Free Call/Music, Sports Earbuds, Sweatproof (8 Hours Playtime, LVL11, Multi)",Wireless,1199,(52% off),2.8,8,Audio,https://www.amazon.in/dp/B0BXPJN22Z,neckband
B0FDLDYZR3,"Bluetooth Earphones for Xiaomi Mi 11 Pro Earphones Original Like Wireless Bluetooth Neckband in-Ear Headphones Headset with Mic, Deep Bass, Sports Earbuds (15 Hours, JO29)",Bluetooth,499,(69% off),4.0,1,Audio,https://www.amazon.in/dp/B0FDLDYZR3,neckband
B09HDMKK3F,"Wireless Bluetooth Headphones Earphones for Samsung Galaxy J7 Nxt Earphone Bluetooth Wireless Neckband Flexible In-Ear Headphones Headset With Mic, Extra Deep Bass Hands-Free Call/Music, Sports Earbuds, Sweatproof (JMD8, Multi)",Wireless,399,(73% off),5.0,2,Audio,https://www.amazon.in/dp/B09HDMKK3F,neckband
B0CZXMRS4J,"WK LIFE BORN TO LIVE- Neckband Wireless Earphone with Wireless 5.3 chip and Skin-Friendly Silicone Memory, 35 Hr Play Time with HD Voice & Battery Level Dislay for Quick Reference- Black",WK,3499,,5.0,1,Audio,https://www.amazon.in/dp/B0CZXMRS4J,neckband
B0FDLCYXC1,Neckband Bluetooth Headphones 9D Surround Sound HiFi Stereo Neck Hanging Noise Reduction in-Ear Wireless Earbuds 8 H Music Time IPX6 Waterproof Ultra-Lightweight Comfort for Sports/Office,Neckband,21329,(50% off),,,Audio,https://www.amazon.in/dp/B0FDLCYXC1,neckband
B0GN1M3MC7,"Original Neckband Wireless Compatible for OnePlus Z2 Neckband, 45dB ANC, Ultra-Low Latency Mode & Magnetic Earbuds for Easy Storage [Black]",Original,999,(60% off),,,Audio,https://www.amazon.in/dp/B0GN1M3MC7,neckband
B0GJ6LBMBC,"Bboatt Dual Battery Neckband Bluetooth Wireless Earphones, 500 Hours Playtime, Metal, Lightweight, Vibration, Magnetic, Voice Changer, ASAP Technology",Bboatt,990,(67% off),,,Audio,https://www.amazon.in/dp/B0GJ6LBMBC,neckband
B0BZYVC6MD,"SoundMAGIC ST80 Neckband Bluetooth Earbuds - Waterproof HiFi Stereo Sound Earphones Wired Detachable in Ear Headphones with Adjustable Metal Mechanism Ear Hooks, Black",SoundMAGIC,11898,(29% off),1.5,2,Audio,https://www.amazon.in/dp/B0BZYVC6MD,neckband
B0F6T75VPN,"Neckband Bluetooth Headphones 200 Hours Battery Life Ultra-Lightweight Comfort Memory Collar ENC Call Noise Cancellation Type-C Fast Charging for Home, Traveling, Outdoor, Business Trips",Neckband,14103,(36% off),,,Audio,https://www.amazon.in/dp/B0F6T75VPN,neckband
B0GCZC6Y36,"Original Wireless Bluetooth Neckband Z2 Compatible for Oneplus with Mic, Bombastic Bass, 10 Mins Charge 20 Hrs Music, 30 Hrs Battery Life [Blue] Color",Original,999,(60% off),,,Audio,https://www.amazon.in/dp/B0GCZC6Y36,neckband
B0BXPLC8Z4,"Wireless Bluetooth Earphones for OPP-O Reno8 / Reno 8 Earphones Original Like Wireless Bluetooth Neckband Flexible in-Ear Headphones Headset with Built-in Mic (8 Hours, LVL11, Multi)",Wireless,1199,(52% off),5.0,1,Audio,https://www.amazon.in/dp/B0BXPLC8Z4,neckband
B0FN4LY68S,"VIDA NeckBlaze V10, Wireless in-Ear Neckband, 40Hrs Playtime, Dual Pairing, Magnetic Hall Sensor, BT v5.4, Type-C Fast Charging, 10mm Drivers, HD Calls with in-Built Mic (Black)",VIDA,898,(61% off),5.0,1,Audio,https://www.amazon.in/dp/B0FN4LY68S,neckband
B0BC9LM78R,Zeb-Yoga 2 Wireless Neckband with 21 hrs.* of Playback time (Black),Zeb-Yoga,999,(41% off),2.8,5,Audio,https://www.amazon.in/dp/B0BC9LM78R,neckband
B0BQ72CVFF,"Portronics Harmonics Z4 Wireless Bluetooth 5.3 Neckband in Ear Earphones with Mic, 30Hrs Playtime, Gaming Mode, Voice Assistance, Magnetic Latch, IPX4 Water Resistant, Type C Fast Charging(Black)",Portronics,798,(68% off),3.8,171,Audio,https://www.amazon.in/dp/B0BQ72CVFF,neckband
B0DK4ZZQ47,"Rythflo Bluetooth Earphones, Neckband Type, 150 Hours of Continuous Playback, Wireless Bluetooth Earphones, with Microphone, Earphones, Waterproof, IPX7, Deep Bass, Type-C Rapid Charging, Ideal for",Rythflo,12587,(46% off),4.1,83,Audio,https://www.amazon.in/dp/B0DK4ZZQ47,neckband
B08WCHC16X,"Avantree Medley Clear - Wireless Earbuds for TV Listening & Watching with Transmitter & Charging Dock, Clear Dialogue, Enhanced Volume, Soundbar Passthrough, 20H Bluetooth Neckband Headphones",Avantree,23599,(26% off),4.1,1.3K,Audio,https://www.amazon.in/dp/B08WCHC16X,neckband
B0G5F45Z65,"Original High-Stability Bluetooth Wireless Neckband White Colour Compatible with Realme Wireless 3, Long Battery Backup & Low Latency*",Original,999,(60% off),4.0,2,Audio,https://www.amazon.in/dp/B0G5F45Z65,neckband
B096XNY7JC,Wireless Bluetooth Earphone Headphone for Calling & Music with mic & Warranty for All Android & Type C Smartphones iOS Devices,Wireless,249,(75% off),3.6,15,Audio,https://www.amazon.in/dp/B096XNY7JC,neckband
B0F1CYY4TD,"Neckband Bluetooth Headset, Vibration, HD Sound Quality (Cyan Blue)",Neckband,379,(62% off),5.0,1,Audio,https://www.amazon.in/dp/B0F1CYY4TD,neckband
B09LDCK3H2,"K1 Wireless Bluetooth Headphones, Headset with Mic and Sound Button Earphone for Mi Note 7/8/9 Pro, 6A, 8A, 9A, A2, Y3 All Smartphone",K1,199,(80% off),2.4,13,Audio,https://www.amazon.in/dp/B09LDCK3H2,neckband
B07WDKLV3F,iQOO Wireless Sport | Bluetooth in-Ear Earphones with Mic | 11.2mm Driver | 80ms Low Latency | 18 hrs Battery | Comfort Fit,iQOO,2499,,3.7,514,Audio,https://www.amazon.in/dp/B07WDKLV3F,neckband
B0F4NHS2XD,"TP Troops Bluetooth Wireless in Ear Earphones with Above 20 Hours Playback, 10mm Dynamic Driver, Gaming Mode, High Bass, IPX4 Water and Sweat Resistant, Type C Fast Charging (Green)",TP,279,(72% off),2.8,17,Audio,https://www.amazon.in/dp/B0F4NHS2XD,neckband
B0CN183TWB,"Wireless BT LVL for Sam-Sung Galaxy Tab Active 2 Original Sports Bluetooth Wireless Earphone with Deep Bass and Neckband Hands-Free Calling inbuilt with Mic,Hands-Free Call/Music (LVLW,GP12BLK)",Wireless,1199,(50% off),,,Audio,https://www.amazon.in/dp/B0CN183TWB,neckband
B09KKGMYWX,"Motorola Ververap 200 Wireless in-Ear Headphones, Compatible with Alexa - Rose Gold",Motorola,5464,(23% off),4.2,23,Audio,https://www.amazon.in/dp/B09KKGMYWX,neckband
B07WRXD37V,3 idea Imagine Create Print Tessco Sports Bluetooth Earphones (EB-284),3,16758,,4.1,3.2K,Audio,https://www.amazon.in/dp/B07WRXD37V,neckband
B08W49ZQR9,"Avantree HT41866 Wireless Earbuds for TV Listening (Set of 2) with Bluetooth Transmitter, Individual Volume Control, 20Hrs Neckband In Ear Headphones, Plug & Play, No Audio Delay",Avantree,22207.19,,4.2,1.5K,Audio,https://www.amazon.in/dp/B08W49ZQR9,neckband
B07GDDL99H,"Avantree HT4186 Wireless Neckband Headphones Earbuds for TV Watching & PC with Bluetooth Transmitter Set, for Optical Digital Audio, RCA, 3.5mm AUX Ported TVs, Plug & Play, No Delay, Long Range",Avantree,16191.93,,4.2,7.6K,Audio,https://www.amazon.in/dp/B07GDDL99H,neckband
B0DBHXW98B,"Portronics Harmonics Z8 Bluetooth Wireless in Ear Earphones with 40H Playback, Magnetic Earbuds(ON/Off), LED Battery Display, 10mm Driver, Gaming/Music Mode, IPX4 Water Resistant, Fast Charging(Black)",Portronics,699,(72% off),3.9,196,Audio,https://www.amazon.in/dp/B0DBHXW98B,neckband
B0BL3XCM3M,PROXN 225 Bluetooth Wireless in Ear Earphones with mic Multi-Coloured,PROXN,199,(75% off),3.5,2,Audio,https://www.amazon.in/dp/B0BL3XCM3M,neckband
B0D6Z2612Y,OneAssist 1 Year Extended Warranty Plan for Headphones Between INR 1501-2000 (E-Mail Delivery),OneAssist,129,(50% off),4.1,1K,Audio,https://www.amazon.in/dp/B0D6Z2612Y,neckband
B0924W6MVQ,"PTron Tangent Plus V2 with 18Hrs Playback & Type-C Fast Charging, Bluetooth 5.0 Wireless Headphones with Deep Bass, IPX4 Water Resistance, Snug-fit, Voice Assistance & Built-in Mic (Black & Red)",PTron,2400,(11% off),3.3,17.4K,Audio,https://www.amazon.in/dp/B0924W6MVQ,neckband
B07R37BSZ6,"Sony WI-C310 Bluetooth Wireless In-Ear Headphones with Mic, up to 15h battery life, Black",Sony,9963,(29% off),3.9,5.3K,Audio,https://www.amazon.in/dp/B07R37BSZ6,neckband
B0F5Q7SLKT,"Drumstone 𝟏𝟓 𝐘𝐞𝐚𝐫𝐬 𝐖𝐚𝐫𝐫𝐚𝐧𝐭𝐲 Wireless Bluetooth Headset with Mic for Hands-Free Calling | Ultra-Lightweight, Noise Cancelling, BT 4.1, Compatible with All Smartphones, Long Battery",Drumstone,1379,,3.6,6,Audio,https://www.amazon.in/dp/B0F5Q7SLKT,neckband
B0DT91SDHQ,WK Life Born to Live- WK Life Born to Live- HiFi Sound Quality Bluetooth Earphone Air-Conduction with New Conduction Technology with Sports Neckband Wireless Headset and Next-gen (White),WK,3499,,,,Audio,https://www.amazon.in/dp/B0DT91SDHQ,neckband
B08ZGG119F,"noot Products NP11 Wireless Bluetooth in-Ear Headphones with Mic, Volume & Remote Control IPX7 Sweatproof Earbuds for Sports, Running, Gym (Black)",noot,1194,(60% off),3.3,2.7K,Audio,https://www.amazon.in/dp/B08ZGG119F,neckband
B0BK5BB6SR,TROXXON CX1 S109 Single Ear Wireless 18 Hours of Calling with 1 Hour Charge Bluetooth Headset with Mic Designed for All Smartphone (Black),TROXXON,319,(68% off),5.0,1,Audio,https://www.amazon.in/dp/B0BK5BB6SR,neckband
B0GHWPZLTY,"Bluetooth Airdops True Wireless Earbuds with Charging CV Colour(Yellow) Case, HD Stereo Sound, Touch Control, Fast Charging, Noise Isolation Mic, Sweat Resistant (BLUTOOTH2)",Bluetooth,599,(57% off),,,Audio,https://www.amazon.in/dp/B0GHWPZLTY,neckband
B0DPG5HLWT,"Bone Conduction Headphones IPX5 Waterproof Swimming Open Ear Headphones Built-in 8GB Bluetooth Open Ear Headset Sport Headphones with Built-in Mic,Sweatproof Headset for Running,Cycling,Black",Bone,46165,(44% off),,,Audio,https://www.amazon.in/dp/B0DPG5HLWT,neckband
B0FNDBJRNK,"Life Like Bluetooth Neckband Headphones, BT 5.4, HiFi Sound, ENC Noise Reduction, IPX5 Waterproof, LED Display, Type-C Fast Charging (Black)",Life,699,(65% off),1.0,1,Audio,https://www.amazon.in/dp/B0FNDBJRNK,neckband
B0GMRC5W24,"Original Bluetooth for OnePlus Z2 ANC Neckband – 45dB Active Noise Cancellation, Dual Device Pairing, HD Mic & Magnetic Auto Connect Blue",Original,1299,(41% off),,,Audio,https://www.amazon.in/dp/B0GMRC5W24,neckband
B0GDV1TXV4,Original Lightweight Compatible with OnePlus Wireless Bullet Z2 Bluetooth Neckband with Clear Mic Red (MB6HG65) (MWER98),Original,999,(55% off),,,Audio,https://www.amazon.in/dp/B0GDV1TXV4,neckband
B0GMPXCQMJ,"TP TROOPS Wireless Bluetooth Neckband Headphone with 50H Playtime, Bluetooth v5.3 Earphone, 10mm Bass Driver, IPX4 Sweat Resistant, Type-C Fast Charging, Voice Assistant Support -(Blue)",TP,399,(69% off),4.6,3,Audio,https://www.amazon.in/dp/B0GMPXCQMJ,neckband
B0GDQW57KY,"Original Neckband for Realme Buds Wireless 5 ANC Bluetooth Headphones, Advanced Noise Cancellation, Rich Sound, Sweat Resistant [Black]",Original,899,(55% off),,,Audio,https://www.amazon.in/dp/B0GDQW57KY,neckband
B0GCRKMZMY,"Original Bluetooth Wireless Neckband Compatible with OnePlus Z3, 45dB Active Noise Cancellation, Dual Device Pairing, HD Mic & Magnetic Auto Connect [Black] Color",Original,999,(60% off),5.0,1,Audio,https://www.amazon.in/dp/B0GCRKMZMY,neckband
B0FL2RWC2H,"Boat Rockerz 238 Pro, 20H Battery, ENx, Beast Mode, Vibration Alert, ASAP Charge, Dual Pairing, Bluetooth Neckband, Wireless with Mic Earphones (Active Black)",Boat,929,(63% off),2.6,5,Audio,https://www.amazon.in/dp/B0FL2RWC2H,neckband
B082XJ543C,"QT Shopping S Bluetooth Headset, Lightweight Retractable for Neckband Bluetooth Headphones for Sports Exercise Home & Office, Noise Cancelling Stereo Neckband Wireless Headset Talk 9-10 Hours",QT,10895,(47% off),2.6,5,Audio,https://www.amazon.in/dp/B082XJ543C,neckband
B0DDR7JH5K,"Drumstone (𝐁𝐔𝐘 𝐎𝐍𝐄 𝐆𝐄𝐓 𝐎𝐍𝐄 Bluetooth FVIP Neckband Earbuds|Portable & Sweatproof, Perfect for Sports & Running | Noise-Cancelling, Multicolor, Compatible with All𝟏𝟓 𝐘𝐄𝐀𝐑𝐒 Warranty",Drumstone,1799,(40% off),5.0,1,Audio,https://www.amazon.in/dp/B0DDR7JH5K,neckband
B0GDTXWTPN,Original Lightweight Compatible with OnePlus Wireless Bullet Z2 Bluetooth Neckband with Clear Mic Blue (MB6HG65) (MWER98),Original,999,(55% off),5.0,1,Audio,https://www.amazon.in/dp/B0GDTXWTPN,neckband
B0GH83GLY2,"inear 2026 Launch DJ-M10 Wireless Neckband, 50H Battery, Dual Pairing, Type-C Fast Charge, HD Sound with Deep Bass,Voice Changer, Magnetic Earbuds, Bluetooth Wireless in-Ear Earphones with Mic | Grey",inear,1273.02,(64% off),3.4,4,Audio,https://www.amazon.in/dp/B0GH83GLY2,neckband
B09WHYZYTH,INVICTO Wireless Neckband Bluetooth Earphone Headset Earbud Portable Headphone Handsfree Sports Running Sweatproof Compatible Android Smartphone Noise Cancellation for All Smartphones (Black),INVICTO,299,(63% off),3.8,13,Audio,https://www.amazon.in/dp/B09WHYZYTH,neckband
B0GCCQ2MZV,"Original Z3 Bluetooth Neckband Earphones Compatible with OnePlus Z3, Deep Bass, 30-Hour Battery Life, Magnetic Design, Comfortable Fit & Clear Sound [Black]",Original,999,(60% off),,,Audio,https://www.amazon.in/dp/B0GCCQ2MZV,neckband
B0G48YSYX8,Original Bluetooth Neckband Earphones Compatible with One Plus Nord CE 2 Nord 2T 9R 10R 11 Deep Bass Wireless in-Ear Headphones with HD Mic Fast Charging Magnetic Sports Neckband Green,Original,999,(60% off),1.0,1,Audio,https://www.amazon.in/dp/B0G48YSYX8,neckband
B0FXXK64YF,"Toreto Wireless Neckband with Magnetic On/Off Hall Sensor 20 Hours of Playtime | Type C Charging (TOR-223, Black)",Toreto,629,(75% off),5.0,24,Audio,https://www.amazon.in/dp/B0FXXK64YF,neckband
B0FQX9CZTJ,"Neckband Bluetooth Headphones，80H Playback Wireless in-Ear Earbuds with Microphone, Sweatproof Around The Neck Headphones for Sport,Running,Workouts (Black)",Neckband,6159,(37% off),4.1,28,Audio,https://www.amazon.in/dp/B0FQX9CZTJ,neckband
B0GRHFTP55,"Wireless Neckband for OnePlus Z2 Wired Earphone Featuring Dynamic Drivers, Deep Bass Music, Noise Reduction Mic, Type-C Charging",Wireless,1299,(19% off),,,Audio,https://www.amazon.in/dp/B0GRHFTP55,neckband
B0FJMNBXQ2,"Probuds Wave 921 (Green) Dual-Tone Noise Cancellation BT Neckband with 50ms Low Latency Gaming, 10mm Drivers, Bass Boost, ENC Calls, 40Hrs Playtime, Fast Charging, IPX6, Dash Switch, Dual Pairing",Probuds,948.39,(68% off),3.8,154,Audio,https://www.amazon.in/dp/B0FJMNBXQ2,neckband
B0BL3XPHSK,PROXN BX-334 Wireless Bluetooth Neckband Audio ProBass Super Sound with Mobile Holder Pyramid Stand Free for All Android and Smartphones (Combo Offer),PROXN,199,(75% off),2.1,4,Audio,https://www.amazon.in/dp/B0BL3XPHSK,neckband
B0G7KD7354,"Original Neckband Compatible for Realme Buds Wireless 3 ANC – Premium Wireless with Mic, Deep Bass Sound, Gaming Mode & Magnetic Instant Connection-(White) AS-Q-60",Original,929,(77% off),,,Audio,https://www.amazon.in/dp/B0G7KD7354,neckband
B0GDDRXBDX,Original 360° Audio Compatible with OnePlus Z3 Wireless Earphones Heavy Bass – Bluetooth Neckband with Mic 12.4mm Drivers IP55 for Music Lovers (RED),Original,999,(55% off),,,Audio,https://www.amazon.in/dp/B0GDDRXBDX,neckband
B0G1C9J45L,"Original Neckband for OnePlus Earphones Z3 ANC – Smart Magnetic Control, Deep Bass Clarity, Type-C Fast Charging & 28 Hours Battery Backup",Original,1399,(30% off),,,Audio,https://www.amazon.in/dp/B0G1C9J45L,neckband
B0B63TSLDN,"PROXN DDX5 D11 Neckband Wireless In Ear Bluetooth Headphones, Built -in Mic, Super Sound Deep Bass Active Noise Cancellation Headphone for All Android Smartphone, iOS Devices and Tables Multicolored",PROXN,199,(60% off),,,Audio,https://www.amazon.in/dp/B0B63TSLDN,neckband
B0GJV8L9W1,"Wireless Neckband Bluetooth Earphones with ENC, Low Latency up to 50ms, Magnetic Earbuds, Splashproof and Sweatproof, 48 Hours Playtime, in-Line Control, Flexible Body, Black and Red",Wireless,,,1.0,1,Audio,https://www.amazon.in/dp/B0GJV8L9W1,neckband
B0F1DTX731,iFAST Bluetooth 6.0 Wireless Neckband Earphone with Extra Replaceable (Rechargeable) Batteries | HiFi Lossless Sound Quality | Non-Stop Music Playback | Clear Calls with Noise Reduction [Black],iFAST,2499,(50% off),3.6,38,Audio,https://www.amazon.in/dp/B0F1DTX731,neckband
B0GRGPMG36,for OnePlus Z2 ANC Neckband Earphone Bluetooth with Active Noise Cancellation Fast Charging Deep Bass Magnetic Earbuds Noise Isolation Built-in Mic (Green) (Neckband Z2),for,1099,(45% off),,,Audio,https://www.amazon.in/dp/B0GRGPMG36,neckband
B0F4XP719J,"Bluetooth Wireless in-Ear Earphones with Mic | Fast Charging 10 Mins = 20 Hrs Music, 30 Hrs Total Battery, Deep Bass, Lightweight Neckband Headphones (Yellow)",Bluetooth,399,(80% off),4.3,4,Audio,https://www.amazon.in/dp/B0F4XP719J,neckband
