asin,product_title,brand,price,discount_percent,rating,review_count,category,product_link,search_term
B08VDNCZT9,"JBL Charge 5, Wireless Portable Bluetooth Speaker Pro Sound, 20 Hrs Playtime, Powerful Bass Radiators, Built-in 7500mAh Powerbank, PartyBoost, IP67 Water & Dustproof (Without Mic, Black)",JBL,11999,(37% off),4.4,31.3K,Audio,https://www.amazon.in/dp/B08VDNCZT9,bluetooth speakers
B094RCC4L1,"Mivi Play Bluetooth Speaker with 12 Hours Playtime. Wireless Speaker Made in India with Exceptional Sound Quality, Portable and Built in Mic-Black",Mivi,839,(58% off),4.1,24.8K,Audio,https://www.amazon.in/dp/B094RCC4L1,bluetooth speakers
B0CLJ7V2JT,"Ambrane 5W Wireless Bluetooth Mini Speaker with 44Hrs Playtime, Immersive Sound, 52mm Driver, Twin Pairing, Integrated Music & Call Control, Built in Mic, IPX4 Water Resistance (Minipod, Green)",Ambrane,649,(64% off),4.3,47,Audio,https://www.amazon.in/dp/B0CLJ7V2JT,bluetooth speakers
B0DSSX42WX,"ZEBRONICS VITA BAR 201, Wireless Bluetooth Soundbar, 30 Watts, Upto 8 Hours Playback, Powerful Dual Drivers, Dual Passive Radiators, LED Indicator, BTv5.3 | USB | AUX",ZEBRONICS,1699,(39% off),3.6,108,Audio,https://www.amazon.in/dp/B0DSSX42WX,bluetooth speakers
B08YQV138W,"Bang & Olufsen Beosound Explore - Wireless Outdoor Bluetooth Speaker, IP 67 Dustproof and Waterproof, Grey Mist",Bang,18000,(10% off),4.3,3.1K,Audio,https://www.amazon.in/dp/B08YQV138W,bluetooth speakers
B0CT5F1SW4,"Tribit XSound Plus 2 30W 5.3 Bluetooth Wireless Speakers,Powerful Louder Stereo Sound with Bass-Enhanced XBass Function,24H Playtime,IPX7 Waterproof,Built in Mic,150ft BT Range for Home/Outdoor,Black",Tribit,5399,(46% off),4.4,2.7K,Audio,https://www.amazon.in/dp/B0CT5F1SW4,bluetooth speakers
B0G2MKMPVZ,"Zebronics 10W Portable Bluetooth v6.0 Speaker, Dual 5.2cm Drivers, 9hr Backup, Retro CD Design, 6 Ambient Sound Effects, TWS Support, Passive Radiator, Built-in Clock, Alarm & Call Function (Echospin)",Zebronics,1999,(58% off),4.2,29,Audio,https://www.amazon.in/dp/B0G2MKMPVZ,bluetooth speakers
B0D7Q6QMJR,"Portronics Harmony Mini 25W HD Premium Portable Bluetooth Speaker with Subwoofer, EQ Adjustment, 6 Hours Playtime, in-Built Mic,TWS Mode,RGB Lights, Bluetooth V5.3, Type C Fast Charging(Black)",Portronics,2799,(44% off),4.3,535,Audio,https://www.amazon.in/dp/B0D7Q6QMJR,bluetooth speakers
B07YNVQJZY,"Zebronics County 3W Wireless Bluetooth Portable Speaker with Supporting Carry Handle, USB, SD Card, FM & Call Function (Blue)",Zebronics,549,(45% off),3.9,10.6K,Audio,https://www.amazon.in/dp/B07YNVQJZY,bluetooth speakers
B0DQQ2VX26,"Boat Stone Ignite w/ 90 W RMS Sound, RGB LEDs, EQ Modes, IPX6,BT v5.3,Multi- Compatibility– Aux&USB, Playback time Up to 5 Hours & Type C Charging (Jade Black)",Boat,7017,(68% off),4.3,214,Audio,https://www.amazon.in/dp/B0DQQ2VX26,bluetooth speakers
B07TBFY4VF,"Portronics 5W Pico Mini HD Sound Portable Bluetooth Speaker with in-Built Mic, Strong Lanyard, Upto 4 Hours Playtime, Bluetooth 5.3V, Type C Fast Charging, Light Weight (Black)",Portronics,699,(30% off),4.2,792,Audio,https://www.amazon.in/dp/B07TBFY4VF,bluetooth speakers
B0FMNPVZVJ,"Zebronics Portable Bluetooth Speaker, 60W, Upto 7 Hours Playback, Dual 16.51cm Drivers, Karaoke, TWS, BT v5.4, USB, mSD, AUX, RGB, Wireless Mic with Display, Mobile Holder (Party Fyre 90)",Zebronics,5999,(54% off),4.0,479,Audio,https://www.amazon.in/dp/B0FMNPVZVJ,bluetooth speakers
B0GL7QWQF1,"Zebronics 50W Bluetooth Speaker, Dual 5.7cm Drivers, 8.9cm Subwoofer, Upto 5Hrs Playback, Dual Passive Radiators, RGB Modes, 6.3mm Mic Input, TWS, BT v5.3, USB, AUX, Type-C (Sound Feast 450)",Zebronics,3499,(50% off),5.0,3,Audio,https://www.amazon.in/dp/B0GL7QWQF1,bluetooth speakers
B01N4V4X5M,Anker Soundcore (Speaker),Anker,,,4.6,33.7K,Audio,https://www.amazon.in/dp/B01N4V4X5M,bluetooth speakers
B0GL3JFDMS,"JBL Compatible Ultra Mini Wireless Bluetooth Speaker with Heavy Metal Electroplated Round Speaker | Wireless Power Button Controlled, Long Battery Backup & Fast Quick Charge (Pack of 1, Multicolor)",JBL,288,(71% off),2.5,2,Audio,https://www.amazon.in/dp/B0GL3JFDMS,bluetooth speakers
B0BSLLKJ78,"Zebronics DC Black ADAM Edition Rocket 500 Bluetooth 5.0 Portable Speaker 20W RMS, TWS, 10 Hour Backup, Built-in Rechargeable Battery, RGB Lights, Detachable Handle, Wired mic Port & Type C",Zebronics,3299,(59% off),3.6,527,Audio,https://www.amazon.in/dp/B0BSLLKJ78,bluetooth speakers
B013T21X42,"Portronics Soundpot 20W Wireless Bluetooth Portable Speaker with 360° immersive Sound, Upto 6 Hours Playtime, in Built Mic, TWS Mode, Easy Control, Strong Lanyard, Type C Fast Charging(Black)",Portronics,1499,(50% off),4.2,6.2K,Audio,https://www.amazon.in/dp/B013T21X42,bluetooth speakers
B01MTB55WH,"Anker Soundcore 2 Portable Bluetooth Speaker With Better Bass, 24-Hour Playtime, 66Ft Bluetooth Range, Ipx5 Water Resistance & Built-In Mic",Anker,6199.20,(32% off),4.6,1.4L,Audio,https://www.amazon.in/dp/B01MTB55WH,bluetooth speakers
B0DS68Z4DZ,"ZEBRONICS County 8, Portable Bluetooth Speaker, 8 Watts, Upto 7 Hours Playback, Passive Radiator, BTv5.3 | TWS | USB | mSD, RGB LED, Call Function, Compact Design, Carry Strap (Black)",ZEBRONICS,631,(43% off),4.1,175,Audio,https://www.amazon.in/dp/B0DS68Z4DZ,bluetooth speakers
B0F3JNTJ7K,"Portronics Fynix 30W HD Sound Portable Bluetooth Speaker with Dual Passive Radiator, 360° Surround Sound, Upto 6 Hours, Handsfree Calling, TWS Pairing, Bluetooth 5.3V, Type C Charging(Black)",Portronics,2499,(38% off),4.1,300,Audio,https://www.amazon.in/dp/B0F3JNTJ7K,bluetooth speakers
B0DCB8FBVK,"amazon basics X20R 20W Bluetooth Soundbar with 2000mAh Battery | 2X Bass | Up to 9hrs of Playback | Bluetooth 5.3, Aux in, USB, Micro TF Card Connectivity (Grey)",amazon,1479,(51% off),3.8,52.3K,Audio,https://www.amazon.in/dp/B0DCB8FBVK,bluetooth speakers
B0CX95S55W,"JBL Clip 5, Wireless Ultra Portable Bluetooth Speaker, Pro Sound, 12hrs of Playtime, Integrated Carabiner, Vibrant Colors with Rugged Fabric Design, Dust & Waterproof, Type C (Without Mic, Squad)",JBL,4019,(38% off),4.6,5.4K,Audio,https://www.amazon.in/dp/B0CX95S55W,bluetooth speakers
B0DQWTH8MK,"ZEBRONICS Sound Feast 55, Portable Bluetooth Speaker, 14 Watts, 10 Hours Playback, Dual 5.7 cm Drivers, Dual Passive Radiator, Call Function, RGB, Bluetooth v5.3 | TWS | USB | mSD | AUX, Deep Bass",ZEBRONICS,1299,(54% off),3.9,739,Audio,https://www.amazon.in/dp/B0DQWTH8MK,bluetooth speakers
B0FQN896CF,"Tribit PocketGo Portable Wireless Bluetooth Speaker with 7W Stereo Sound, IP68 Waterproof Dustproof, 20H Playtime, Custom EQ, BT6.0 & TWS Pairing, Supports TF Card, Ideal for Travel, Outdoor, Gifts",Tribit,2999,(25% off),4.4,550,Audio,https://www.amazon.in/dp/B0FQN896CF,bluetooth speakers
B0FFHCZPWC,"GOVO GOSURROUND 600 | 90W Soundbar | 2.1 Channel Home Theatre | Deep Bass from 4” Subwoofer | BT v5.3, HDMI, AUX, USB Connectivity | 5 EQ Modes",GOVO,2799,(77% off),3.9,36,Audio,https://www.amazon.in/dp/B0FFHCZPWC,bluetooth speakers
B0GF1RWB4D,"mini Portable Bluetooth Speaker, White and Turquoise, Wireless Audio Device with Control Buttons",mini,283,(72% off),2.6,9,Audio,https://www.amazon.in/dp/B0GF1RWB4D,bluetooth speakers
B0BGYCY8VR,"Soundcore Anker Rave Neo 2 Portable Speaker with 80W Stereo Sound,Partycast 2.0,Light Show,Ipx7 Waterproof(Floats On Water) 18H Playtime,Customizable Eq & Bass Up for Party,Backyard-Black,USB",Soundcore,12999,(24% off),4.6,261,Audio,https://www.amazon.in/dp/B0BGYCY8VR,bluetooth speakers
B0CW38T5QK,"Mivi Fort Q18 Soundbar with 18W Bluetooth Speakers Soundbar, 2.0 Channel with 2 in-Built Full-Range Speakers, Multiple Input Modes, 6H Playtime, 2000mAh, Made in India Sound bar for TV",Mivi,999,(71% off),3.9,1.1K,Audio,https://www.amazon.in/dp/B0CW38T5QK,bluetooth speakers
B0FGVXDQ31,"QCY SP7 Portable Bluetooth Speaker – 40W Stereo Sound, 105 dB Loud Output, TWS Multi-Speaker Pairing, 15 RGB Light Modes, IPX7 Waterproof, 14H Battery Life",QCY,3999,(33% off),4.4,43,Audio,https://www.amazon.in/dp/B0FGVXDQ31,bluetooth speakers
B0FPR7WMGY,"GOBOULT Newly Launched Bassbox X20 Bluetooth Speaker 20 Watt BoomX Audio, Up to 6 Hrs Playtime, Type-C Charging, AUX/TF Card/USB & BTv 5.4, Bluetooth Sound Bar Portable (Pure Black)",GOBOULT,1599,(77% off),4.0,27,Audio,https://www.amazon.in/dp/B0FPR7WMGY,bluetooth speakers
B08HD28LJ6,"ZEBRONICS Sound Feast 50, 14 W Portable Speaker Supporting Bluetooth, Pendrive Slot, mSD Card, Call Function (Black)",ZEBRONICS,849,(66% off),3.8,4.2K,Audio,https://www.amazon.in/dp/B08HD28LJ6,bluetooth speakers
B08NQXP8CR,HP 360 Mono Portable Silver Bluetooth Speaker with Built-in Microphone Ip54 Dust and Water Resistance (2D801AA),HP,1189,(60% off),3.6,233,Audio,https://www.amazon.in/dp/B08NQXP8CR,bluetooth speakers
B0DG2CQ728,"Creative Pebble Pro Minimalist 2.0 USB-C Computer Speakers with Bluetooth 5.3 and Customizable RGB Lighting, Clear Dialog and BassFlex Tech, USB Audio, Headset Port, for PC and Mac (White)",Creative,5871,(41% off),4.2,387,Audio,https://www.amazon.in/dp/B0DG2CQ728,bluetooth speakers
B0FXRFKQ2K,"pTron Fusion Octane 48W Bluetooth Party Speaker w/Punchy Sound, 8 inch Neo Driver, Breathing RGB Lights, 6Hrs Playtime, BT5.3/Aux/TF Card/USB Playback Modes, Type-C Charging, Portable (Jade Black)",pTron,2099,(65% off),3.8,68,Audio,https://www.amazon.in/dp/B0FXRFKQ2K,bluetooth speakers
B0FXRH3QJ6,"pTron Fusion Beats 48W Bluetooth Party Speaker w/Immersive Sound, Dual 4 inch Neo Drivers, Rhythmic RGB Lights, 6Hrs Playtime, BT5.3/Aux/TF Card/USB Playback Modes, Type-C Charging (Midnight Black)",pTron,2099,(65% off),3.9,71,Audio,https://www.amazon.in/dp/B0FXRH3QJ6,bluetooth speakers
B0F636P8NJ,"pTron Funk Wow 6W Ultra Portable Bluetooth Speaker with Pristine Sound, IPX5 Water-Resistance, 10hrs Playtime, Multi-Playback Modes, True Wireless Feature, Lightweight & Type C Charging (Black)",pTron,699,(83% off),3.4,447,Audio,https://www.amazon.in/dp/B0F636P8NJ,bluetooth speakers
B0DMNHYM33,"Mivi Fort H30 Portable Bluetooth Speakers Soundbar – [Newly launched] 30W Bluetooth Soundbar for Campus Life, 2.0 Channel, Sleek Design, 6 Hours Playtime, Multi-connectivity, Made in India",Mivi,1449,(76% off),3.8,1.3K,Audio,https://www.amazon.in/dp/B0DMNHYM33,bluetooth speakers
B0BGT49YPQ,"Ambrane 5W Wireless Bluetooth Mini Speaker with 12Hrs Playtime, Immersive Sound, 40mm Driver, Bluetooth V5.1 Strong Connectivity, Portable Design, Integrated Music & Call Control (Cube +, Red)",Ambrane,549,(68% off),3.4,114,Audio,https://www.amazon.in/dp/B0BGT49YPQ,bluetooth speakers
B0DJ33F2JQ,"Portronics Trifusion 16W HD Sound Bluetooth Speaker with 15W Wireless Charging, 360°RGB LED Lights, Digital Clock with Alarm Setting, Built-in White Noise, USB/SD Card/AUX in, Type C Charging(Black)",Portronics,1549,(48% off),3.6,355,Audio,https://www.amazon.in/dp/B0DJ33F2JQ,bluetooth speakers
B0FLYBFZL5,"Boat PartyPal 65 Pro, 42W Signature Sound, Wireless Karaoke Mic, 8H Battery,RGB LEDs, TWS, Bass Boost, Multi Port, Bluetooth Speaker, Wireless Speaker, Portable Speaker (Premium Black)",Boat,4499,(72% off),4.1,32,Audio,https://www.amazon.in/dp/B0FLYBFZL5,bluetooth speakers
B0919Z8Q8Y,Marshall Tufton 80 Watt Wireless Bluetooth Portable Speaker (Black & Brass),Marshall,39998,(17% off),4.6,434,Audio,https://www.amazon.in/dp/B0919Z8Q8Y,bluetooth speakers
B0DRSPB2QJ,"ZEBRONICS Sound Feast 75, Portable Bluetooth Speaker, 14 Watts, 10 Hours Playback, Transparent Body, Dual 6.6 cm Drivers, Carry Strap, Bluetooth v5.3 | TWS | mSD | AUX (Black)",ZEBRONICS,999,(72% off),4.0,129,Audio,https://www.amazon.in/dp/B0DRSPB2QJ,bluetooth speakers
B09P53B3M5,"ZEBRONICS Zeb-Buddy 100 Portable BT v5.0 Speaker with TWS, 20W RMS, Wired mic Karaoke, 5H Backup, RGB LED, AUX, USB, Micro SD, Built in Rechargeable Battery and Mobile Holder, Black",ZEBRONICS,1399,(50% off),3.4,2.4K,Audio,https://www.amazon.in/dp/B09P53B3M5,bluetooth speakers
B0DN5Q5P9C,"amazon basics Bluetooth Speaker 5.3 Soundbar with 16W RMS, 2000mAh Battery, Upto 8 Hrs @50% Volum Playtime Aux/USB Port (Black)",amazon,989,(60% off),3.9,3K,Audio,https://www.amazon.in/dp/B0DN5Q5P9C,bluetooth speakers
B0CSYX5RF6,"Blaupunkt Newly Launched SBA20 Pro 25W Bluetooth Soundbar with 2000mAh Battery I RGB Lights I Honeycomb Design I AUX, Bluetooth, USB & TWS I BT Speaker for TV, Mobile, PC, Laptops",Blaupunkt,1439,(71% off),3.9,1.7K,Audio,https://www.amazon.in/dp/B0CSYX5RF6,bluetooth speakers
B0DVZF8RQF,"pTron Fusion Pro Retro Signature 20W Bluetooth Speaker with Pristine Sound, 8 Hours Playtime, Dual Drivers, Playback via BT5.3/USB/TF Card, Easy Controls, Portable Speaker & Type C Charging (Black)",pTron,1499,(69% off),3.8,543,Audio,https://www.amazon.in/dp/B0DVZF8RQF,bluetooth speakers
B0FLYCFPRG,"Boat 2026 Launch Nirvana Luxe,360- Surround, Spatial Audio, 100W, 15hrs Battery, Broadcast, App Support, NFC Pairing (Android), Bluetooth Speaker, Wireless Speaker, Portable Speaker (Charcoal Black)",Boat,9999,(60% off),3.8,37,Audio,https://www.amazon.in/dp/B0FLYCFPRG,bluetooth speakers
B0FN7H3GLN,"Zebronics Compact Soundbar, 18 Watts, Upto 6 Hours Playback, Dual 52mm Drivers, Dual Passive Radiators, TWS, Type-C Charging, USB, AUX, LED Indicator (Vita Bar 202)",Zebronics,1199,(40% off),3.8,210,Audio,https://www.amazon.in/dp/B0FN7H3GLN,bluetooth speakers
B0F8MX4YSZ,"10W Mini Bluetooth Speaker K12 with Wireless Karaoke Mic, 8 Hours Playtime, RGB Lights, BT5.1, Type-C Charging",10W,381,(65% off),3.5,9,Audio,https://www.amazon.in/dp/B0F8MX4YSZ,bluetooth speakers
B0GDGR4Q2K,"Portronics 30W Dash Wireless Bluetooth Portable Speaker with Dual Wireless Karaoke Mic, Echo Control, 5 Hour Playtime, RGB LED Light, Bluetooth V5.4, Easy Grab Handle, USB in, Type C Charging(Black)",Portronics,2699,(46% off),4.5,7,Audio,https://www.amazon.in/dp/B0GDGR4Q2K,bluetooth speakers
B0FDFRGWLQ,"Boat Aavante 2.1 1600D / Orion Plus, Dolby Audio, 160W Signature Sound, 2.1CH Wired Subwoofer,Multiple Ports & EQ Modes, Bluetooth Sound bar, Home Theatre Soundbar Speaker (Premium Black)",Boat,6499,(70% off),4.0,4.6K,Audio,https://www.amazon.in/dp/B0FDFRGWLQ,bluetooth speakers
B0CYXXLLFB,INEFABLE Mini Boost 4 Bluetooth Speaker 4D Mini Electroplating Round Steel Speaker - Multicolor - Pack of 1,INEFABLE,301,(67% off),3.6,566,Audio,https://www.amazon.in/dp/B0CYXXLLFB,bluetooth speakers
B08VD5DC5L,"JBL Charge 5, Wireless Portable Bluetooth Speaker Pro Sound, 20 Hrs Playtime, Powerful Bass Radiators, Built-in 7500mAh Powerbank, PartyBoost, IP67 Water & Dustproof (Without Mic, Blue)",JBL,11999,(37% off),4.4,31.3K,Audio,https://www.amazon.in/dp/B08VD5DC5L,bluetooth speakers
B0FN3YCKXZ,TEMPT Cameo Bluetooth Speaker | 6W in-Built Subwoofer & Mic | 6hrs Playtime | Powerful Bass | Magnetic Stick on Design | RGB Lights | Portable Travel Speaker (Black),TEMPT,999,(50% off),4.5,90,Audio,https://www.amazon.in/dp/B0FN3YCKXZ,bluetooth speakers
B0C3VYT6Q6,"JBL Charge 5 Wi-Fi, Wireless Portable Bluetooth Speaker, Original Pro Sound, 20 Hours Playtime, Deep Bass, Built-in Powerbank, Wi-Fi with AirPlay, IP67 Water & Dustproof, One App (Black)",JBL,12999,(52% off),4.5,1.7K,Audio,https://www.amazon.in/dp/B0C3VYT6Q6,bluetooth speakers
B0BZJYLSPB,"INVICTO A011 5W Wireless Bluetooth Portable Speaker with Supporting Carry Handle, USB, SD Card, AUX, FM & Call Function Upto 4hrs Playtime",INVICTO,328,(59% off),3.9,21,Audio,https://www.amazon.in/dp/B0BZJYLSPB,bluetooth speakers
B0DSVRLMV5,"Tribit StormBox Mini+ Bluetooth Speaker 12W,360°Surround Sound,Custom EQ,12H Playtime,BT 5.4,AAC/SBC Support,LED Lights,IPX7 Waterproof,TWS Pairing,Type-C, Portable for Home/Outdoor/Travel Black",Tribit,2499,(42% off),4.3,1.2K,Audio,https://www.amazon.in/dp/B0DSVRLMV5,bluetooth speakers
B0CKL1TXHN,"Sonos Era 100 | Smart Speaker with WiFi, Bluetooth, Amazon Alexa - Black",Sonos,22999,(23% off),4.4,69,Audio,https://www.amazon.in/dp/B0CKL1TXHN,bluetooth speakers
B0DSL9P1ZM,"PHILIPS TAS1209 Wireless Portable Bluetooth Speaker with 5W Output, Punchy Bass with Radiator, Stereo Pairing, IPX4 Splash Resistant, Hands-Free Calls (Black)",PHILIPS,899,(47% off),3.6,41,Audio,https://www.amazon.in/dp/B0DSL9P1ZM,bluetooth speakers
B0F96FWCDF,"Marshall Kilburn III Portable Bluetooth Speaker with 50+ Hours of Portable Playtime, (360° Sound), Dust & Water-Resistant (IP54) – Black & Brass.",Marshall,35999,,4.7,366,Audio,https://www.amazon.in/dp/B0F96FWCDF,bluetooth speakers
B0DP7PJ99Y,"Portronics 30W Radiant 2 Portable Bluetooth Speaker with Wireless Karaoke Mic,6 Hour Playtime,HD Clarity Sound, Dual Driver, RGB LEDs, TWS Mode, BT5.3v, USB Drive, Aux in, Type C Fast Charging(Black)",Portronics,3699,(38% off),3.9,115,Audio,https://www.amazon.in/dp/B0DP7PJ99Y,bluetooth speakers
B0F8XNKQKC,"Mini Boost Portable Bluetooth Speaker, Wireless Stereo Sound System, High Bass, Loud Clear Audio, Compact Waterproof Travel Speaker with Mic, Long Battery Life, Outdoor & Indoor Use",Mini,264,(56% off),3.5,6,Audio,https://www.amazon.in/dp/B0F8XNKQKC,bluetooth speakers
B0BTHL673V,"Marshall Middleton Portable Bluetooth Speaker with 20+ Hours of Portable Playtime, 360° Sound, Dust & Waterproof (IP67) - Black & Brass.",Marshall,26999,(16% off),4.4,1.8K,Audio,https://www.amazon.in/dp/B0BTHL673V,bluetooth speakers
B0FBX3H27D,"Philips TAS3400BK Portable Bluetooth Speaker with 40W Output, 4000mAh Battery, Stereo Sound, Bluetooth v5.3, IPX5 Sweatproof, RGB Light Modes, Mesh Build, AUX/TF/USB Support w/Hanging Strap (Black)",Philips,2830,(43% off),3.9,57,Audio,https://www.amazon.in/dp/B0FBX3H27D,bluetooth speakers
B0CW39HC2Y,"Portronics Talk Three Wearable Bluetooth Speaker with Mic, Magnetic/Spring Clip-On, Upto 10Hours Playtime, IPX5 Water/Dust Resistant, Bluetooth 5.3v, Big Buttons, Portable Speaker with Microphone",Portronics,1399,(53% off),3.8,955,Audio,https://www.amazon.in/dp/B0CW39HC2Y,bluetooth speakers
B0FFHH36CJ,"pTron Fusion Play Portable 34W Bluetooth Speaker w/Immersive Sound, Vivid RGB Lights, Party Speaker w/ 7 Hrs Playtime, BT5.3/Aux/TF Card/USB Playback, 6.5mm Karaoke Mic Port, Type-C Charging (Black)",pTron,1799,(65% off),3.8,509,Audio,https://www.amazon.in/dp/B0FFHH36CJ,bluetooth speakers
B0DP9SDNQQ,"ZEBRONICS Sound POD 30 Portable Bluetooth Speaker, 12 Watts, Upto 8 Hours Playback, Passive Radiator, BTv5.3 | mSD | TWS | Splash Proof, RGB LED, Carry Handle, Deep Bass (Green)",ZEBRONICS,535,(72% off),3.7,111,Audio,https://www.amazon.in/dp/B0DP9SDNQQ,bluetooth speakers
B09XBH7SMM,"JBL PartyBox 710 Bluetooth Party Speaker with Dynamic Music Synced Flashing Club Pattern Lightshow, Pro Sound, Splashproof, PartyBox App Personalisation,Guitar and Mic Input(800 Watt RMS, Black)",JBL,,,4.5,157,Audio,https://www.amazon.in/dp/B09XBH7SMM,bluetooth speakers
B0D92KZYGP,"Nu Republic Party Box 160 Bluetooth Soundbar with X-Bass Technology, 52mm Dual Dynamic Drivers, 16W Output, Upto 10 Hrs Playtime, Multiple RGB LED Lights, USB Port, Bluetooth 5.3v (Black, 2.0 Channel)",Nu,699,(83% off),4.2,20,Audio,https://www.amazon.in/dp/B0D92KZYGP,bluetooth speakers
B0DX78BKPF,"Portronics Nadya 6W Magnetic Bluetooth Speaker with MagSafe Mobile Stand, HD Sound, Upto 4 Hours Playtime, 40mm Driver, RGB LED Lights, Bluetooth 5.3V, Transparent Speaker, Type C Charging(Black)",Portronics,949,(53% off),4.1,397,Audio,https://www.amazon.in/dp/B0DX78BKPF,bluetooth speakers
B0CX588NB9,"JBL Go 4 in Pink - Portable Bluetooth Speaker Box Pro Sound, Deep Bass and Playtime Boost Function - Waterproof and Dustproof - 7 Hours Runtime",JBL,3999,(33% off),4.8,996,Audio,https://www.amazon.in/dp/B0CX588NB9,bluetooth speakers
B0DPT9S37H,"pTron Musicbot Lite 6W Bluetooth Speaker with 8 Hrs Playtime, 2.04"" Neo Driver for Pristine Sound, Mini Size Portable Speaker, BTv5.1 Connectivity, TWS Feature & Type C Charging (Silver)",pTron,498,(67% off),3.9,478,Audio,https://www.amazon.in/dp/B0DPT9S37H,bluetooth speakers
B08HRWSYH6,"JBL Clip 4, Wireless Ultra Portable Bluetooth Speaker, Pro Sound, Integrated Carabiner, Vibrant Colors with Rugged Fabric Design, Dust & Waterproof, Type C (Without Mic, Black)",JBL,3991,(27% off),4.4,14.8K,Audio,https://www.amazon.in/dp/B08HRWSYH6,bluetooth speakers
B0BRQ3FZ2L,"MIATONE Bluetooth Speakers, Waterproof and Portable Outdoor Wireless Speaker (Matte Black)",MIATONE,10913,(23% off),4.4,853,Audio,https://www.amazon.in/dp/B0BRQ3FZ2L,bluetooth speakers
B0FDGV6D7L,"Nu Republic Sonicpop 2000 Wireless Speaker 16W Output, 6 Hrs Playtime, 66mm Dynamic Driver, Multi RGB Led Lights (Black)",Nu,649,(94% off),3.6,72,Audio,https://www.amazon.in/dp/B0FDGV6D7L,bluetooth speakers
B0GCCCKTZG,"Portronics Apollo One 20W Wireless Bluetooth Portable Speaker with Wireless Karaoke Mic, 5 Hour Playtime, RGB LED Light, Bluetooth V5.3, Easy Grab Handle, USB/AUX in/TF Card, Type C Charging(White)",Portronics,1299,(48% off),4.1,12,Audio,https://www.amazon.in/dp/B0GCCCKTZG,bluetooth speakers
B0DK1BJ8RK,"Portronics Soundpot Pro 20W Portable Bluetooth Speaker with in Built Mic, Immersive Sound, Upto 5 Hours Playtime, Ambient LED Light, TWS Mode, Bluetooth V5.3, USB Port, Type C Fast Charging(Black)",Portronics,1499,(57% off),4.0,65,Audio,https://www.amazon.in/dp/B0DK1BJ8RK,bluetooth speakers
B088KRKFJ3,"Marshall Stockwell II Portable Bluetooth Speaker with 20+ Hours of Portable Playtime, (360° Sound), Water-Resistant (IPX4) – Black & Brass.",Marshall,21499,(14% off),4.5,2.7K,Audio,https://www.amazon.in/dp/B088KRKFJ3,bluetooth speakers
B0FP4RT153,"Toreto 10W Bluetooth Speaker, 6 Hours Playtime HD Sound, Bluetooth 5.3v/USB/TF Card/Aux in, Speaker for Phone, Laptop, Tablets, Type C Fast Charging Easy Controls, Portable Speaker (Jolly+, White)",Toreto,929,(42% off),4.4,27,Audio,https://www.amazon.in/dp/B0FP4RT153,bluetooth speakers
B0DXKYLH99,"Ultimate Ears Boom 4 Portable Waterproof Bluetooth Speaker with 360-Degree, Bold, Immersive, Crystal-Clear Sound, Floating Speaker with 15-Hour Battery and 147ft (45m) Range - Black",Ultimate,15595,(17% off),4.6,9,Audio,https://www.amazon.in/dp/B0DXKYLH99,bluetooth speakers
B0CW9N3XF1,"Tribit StormBox 2 Bluetooth Speaker with 34W 360° Surround Sound, XBass Tech, 24H Playtime, IPX7 Waterproof, Bluetooth 5.3, TWS Pairing Portable Wireless Speaker for Outdoor",Tribit,5999,(33% off),4.2,1.7K,Audio,https://www.amazon.in/dp/B0CW9N3XF1,bluetooth speakers
B0FD7TP2J7,"ZEBRONICS Prima, Portable Bluetooth Speaker, 90 Watts, Upto 9 Hours Playback, Dual 11.8cm Drivers, Dual Passive Radiators, BTv5.4 | TWS | AUX | USB, Carry Strap, Deep Bass, Splash Proof (Black)",ZEBRONICS,6999,(70% off),5.0,2,Audio,https://www.amazon.in/dp/B0FD7TP2J7,bluetooth speakers
B0GKJ1DJRX,"acer GlowTime Alarm Clock Bluetooth Speaker with 15W Wireless Charging | 10W Stereo Output (5W×2) | 13 RGB Lighting Effect | FM, USB/TF/AUX | Timer, White Noise, 12/24H LED Display | 1800mAh Battery",acer,2598,(42% off),3.5,7,Audio,https://www.amazon.in/dp/B0GKJ1DJRX,bluetooth speakers
B0BHDV8GNK,"Marshall Woburn III Wireless Bluetooth Powered Speaker (Cream), 150 Watts",Marshall,49999,(17% off),4.6,374,Audio,https://www.amazon.in/dp/B0BHDV8GNK,bluetooth speakers
B0GF8KV7MR,"Toy Imagine Bluetooth Toy Car Speaker | Portable Car-Shaped Wireless Speaker with 5W Stereo Sound & 1200mAh Battery | TF/USB/FM/TWS Support, Multicolor Music Toy",Toy,649,(68% off),4.8,89,Audio,https://www.amazon.in/dp/B0GF8KV7MR,bluetooth speakers
B09Q59321N,"Tribit StormBox Micro 2 Portable Speaker: 90dB Loud Sound Deep Bass IP67 Waterproof Small Speaker Built-in Strap, 12H Playtime Long Battery 120ft for Outdoor Camping Biking (Black)",Tribit,5499,(45% off),4.3,4.6K,Audio,https://www.amazon.in/dp/B09Q59321N,bluetooth speakers
B0CWD1FGL2,"ZEBRONICS 120 Watts Party Speaker with 2 Wireless Mic, 7 hrs Playtime, Karaoke & Recording Function, TWS, Bluetooth, USB, AUX, mSD, RGB Modes (Thump 700 Black)",ZEBRONICS,9999,(61% off),3.8,8.8K,Audio,https://www.amazon.in/dp/B0CWD1FGL2,bluetooth speakers
B0FJ1PZZ6W,"JBL Partybox Encore Essential 2 Wireless Bluetooth Party Speaker, AI Sound Boost, Dynamic Light Show, Upto 15Hrs Playtime, Multi-Speaker Connection by Auracast, Guitar & Mic Inputs, PartyBox App-Black",JBL,19999,(33% off),4.2,14,Audio,https://www.amazon.in/dp/B0FJ1PZZ6W,bluetooth speakers
B0BTDB3JYN,"CrossBeats Blaze B24 Bluetooth Soundbar 24W, Gaming RGB Lights, AUX, Bluetooth, USB, FM & TWS I Fast SnapCharge Battery, Multiport Connectivity, BT Speaker for TV, Mobile, PC, Laptops, Tablets Black",CrossBeats,1599,(60% off),4.0,2.1K,Audio,https://www.amazon.in/dp/B0BTDB3JYN,bluetooth speakers
B0CXLDSHSH,"JBL Xtreme 4 Portable Bluetooth Speaker, ProSound with Powerful Bass Radiators, AI Sound Boost, Built-in Powerbank, Multispeaker Connection by Auracast, IP67, Replacable Battery, Fast Charging (Black)",JBL,22999,(28% off),4.3,102,Audio,https://www.amazon.in/dp/B0CXLDSHSH,bluetooth speakers
B0FJMQQGQB,Blaupunkt Atomik Knightz 45K I India’s First Most Powerful 450W Party Speaker Boombox I Big 6 Speakers I Never Before 27K mAh Removable Battery I Neon Lights I IPX6 Splash Proof I Wireless Karaoke,Blaupunkt,24990,(50% off),4.2,58,Audio,https://www.amazon.in/dp/B0FJMQQGQB,bluetooth speakers
B0FYNW4CJV,"pTron Fusion ONE 48W Bluetooth Party Speaker w/Pristine Stereo Sound, Dual 4 inch Neo Drivers, Rhythmic RGB Lights, 6Hrs Playtime, BT5.3/Aux/TF Card/USB Playback Modes, Type-C Charging (Jet Black)",pTron,2099,(65% off),5.0,6,Audio,https://www.amazon.in/dp/B0FYNW4CJV,bluetooth speakers
B0DHY5CPVS,"Mini Speaker Boost-4 Mini Wireless Protable Bluetooth Speaker with Dynamic Metal Sound, Wireless Remote Shutter, Long-Lasting Battery, Compact & Durable Design, (Multicolor)",Mini,295,(70% off),3.8,15,Audio,https://www.amazon.in/dp/B0DHY5CPVS,bluetooth speakers
B0CX1NK999,"JBL Partybox 320, Portable Bluetooth 240W Party Speaker, AI Sound Boost, Futuristic Light Show, Multispeaker Connection by Auracast, Telescopic Handle & Wheels, Dual Guitar & Mic Inputs (Black)",JBL,39999,(27% off),4.6,1.1K,Audio,https://www.amazon.in/dp/B0CX1NK999,bluetooth speakers
